id,created_at,text,favorite_count,retweet_count,is_retweet,language,media_type
1394347803854376960,2021-05-17 17:43:16+00:00,"Native Hawaiians and Pacific Islanders have faced disproportionately high rates of hospitalization during the COVID-19 pandemic, yet their community leaders have had to fight for their struggles to be seen. #APAHM https://t.co/uN7BJaDvsF",1,1,No,en,no media
1394346855245389825,2021-05-17 17:39:30+00:00,AsAm fam! Do you have a pic of your grandparents or parents that you absolutely love? I'm collecting old school photos for a #APAHM roundup of Asian American couples through history. Email your photo + some basic info about the couple to brittany.wong@huffpost.com (Pic cred LIFE) https://t.co/7K5JhwOMzE,0,12,Yes,en,no media
1394335762804523012,2021-05-17 16:55:26+00:00,Startling new study data from the World Health Organization connects working long hours to death from heart disease and stroke. https://t.co/TmqwvfYz62,0,0,No,en,no media
1394324519737827333,2021-05-17 16:10:45+00:00,"Amy Adams plays an agoraphobic psychologist in COVID-delayed ""The Woman in the Window."" https://t.co/cZq7Q1s6j7",0,1,No,en,no media
1394313811033829381,2021-05-17 15:28:12+00:00,It’s important to know when certain behaviors should be addressed with therapy or medical attention. https://t.co/f2neXAcZ8K,0,0,No,en,no media
1394283118975143937,2021-05-17 13:26:14+00:00,"Looking for relief from seasonal allergy symptoms like itchy eyes, sneezing and a runny nose? These tips and products may help. https://t.co/hFM5kYih3B",0,0,No,en,no media
1394255725103362048,2021-05-17 11:37:23+00:00,Rosacea is a lot more common than you may think. Experts share how to get it under control. https://t.co/cXy4Rlqrbu,2,1,No,en,no media
1394228766260535297,2021-05-17 09:50:16+00:00,"We likely won’t reach herd immunity, but a few things — from rapid tests to genetic sequencing — can help us move forward. https://t.co/rv4JlnBqjk",2,2,No,en,no media
1394034404117389315,2021-05-16 20:57:56+00:00,Director Rochelle Walensky and Dr. Anthony Fauci cited recent scientific data for the CDC's mask guidance change following complaints from Republican lawmakers. https://t.co/s1UnW9oAOY,0,1,No,en,no media
1393977825405935626,2021-05-16 17:13:07+00:00,"One photojournalist estimated seeing at least 300 shallow graves along a sand bar near Prayagraj, a city in Uttar Pradesh state, on Saturday. https://t.co/LdNwkOst1N",0,1,No,en,no media
1393914924766842881,2021-05-16 13:03:10+00:00,"""When the Supreme Court's decision finally etched itself upon the country, the social stuff of that imprinting behaved in ways other than intended."" https://t.co/d1vIT3GPFB",2,1,No,en,no media
1393794450971893761,2021-05-16 05:04:27+00:00,"The ""patron saint of Purrell"" explains it all. https://t.co/mcpwMCrFoW",2,1,No,en,no media
1393723186152419330,2021-05-16 00:21:16+00:00,The 16-year-old said she was forced to cut out her hair accessories in the middle of the game in order to continue playing. https://t.co/yFUyOSAmNu,0,0,No,en,no media
1393642433502715906,2021-05-15 19:00:23+00:00,"For #APAHM, we asked Asian American writers, artists and other creators to share what they're reading and watching. https://t.co/xb22EA2TwB",1,0,No,en,no media
1393600353690656769,2021-05-15 16:13:10+00:00,"The Disney+ star discusses his character's Season 2 growth, writing songs and, of course, that ""Drivers License"" drama. https://t.co/DIoROOAI6V",0,0,No,en,no media
1393569477523120130,2021-05-15 14:10:29+00:00,This author is educating the public on the importance of including Black people in research on long-haul COVID-19. https://t.co/arzf5ZT3LH,1,0,No,en,no media
1393538936706850817,2021-05-15 12:09:07+00:00,"Big Tech needs to take more decisive action against the ""Disinformation Dozen,"" says the group that identified them. https://t.co/bloc7bB6Gy",3,3,No,en,no media
1393508050775035908,2021-05-15 10:06:24+00:00,"The actors have joined ""The Proud Family: Louder and Prouder"" as adoptive parents of a young activist, played by Keke Palmer. It's due out in 2022. https://t.co/a7LlQD0F3j",5,1,No,en,no media
1393489452517953538,2021-05-15 08:52:29+00:00,"""I've just frankly had enough with these marauding goons in the Marjorie Taylor Greene crowd,"" said the Democrat, who admitted using some ""choice"" language. https://t.co/fy7LqmM7ku",3,2,No,en,no media
1393459211858808834,2021-05-15 06:52:19+00:00,"""Thank you Arthur for the gay rat wedding,"" one Twitter user politely wrote. https://t.co/QNOpiWya9E",1,0,No,en,no media
1393441550529597441,2021-05-15 05:42:09+00:00,The United Food and Commercial Workers union fears the relaxed guidelines will create more uncertainty for grocery workers. https://t.co/g0MaqDtk89,0,0,No,en,no media
1393410703692808195,2021-05-15 03:39:34+00:00,When can your child receive the vaccine? Is it safe? What about boosters? Here's what parents need to know. https://t.co/ECVNConaA6,4,0,No,en,no media
1393380341147217923,2021-05-15 01:38:55+00:00,Tedros Adhanom Ghebreyesus has urged wealthy nations to donate vaccines to other countries where even front-line health care workers can't get access. https://t.co/OgKJXqt4tJ,3,1,No,en,no media
1393349558017708032,2021-05-14 23:36:36+00:00,"The Korean-Canadian playwright saw a career milestone cut short by COVID-19, but her stage and screen plans are far from over. #APAHM https://t.co/zWpAC4TP8N",2,0,No,en,no media
1393318642855686144,2021-05-14 21:33:45+00:00,"The ""Hacks"" star had a kissing scene scheduled and it got ""so weird,"" she told Seth Meyers on ""Late Night."" https://t.co/P9xNRpcrzZ",1,0,No,en,no media
1393310836484157440,2021-05-14 21:02:44+00:00,"Your leftovers are still great, but they may not pack as much nutritional punch as they did the first time around. https://t.co/BrSrkexRhO",0,0,No,en,no media
1393301482821328904,2021-05-14 20:25:34+00:00,"Josie Morales doesn't regret joking about a customer’s very elaborate Frappuccino order, saying “I feel like it brought some light upon how crazy orders can be.” https://t.co/h2dq0FkHyI",2,1,No,en,no media
1393289297965592585,2021-05-14 19:37:09+00:00,"From the best pots to pest hacks to soil mixers and worm poop, these products will help your houseplants grow and thrive. https://t.co/QWJhiZFzLj",0,0,No,en,no media
1393280033087754241,2021-05-14 19:00:20+00:00,"This woman explores how her Asian American identity shifted as she grew up, and reflects on a trip to see family in Taiwan that solidified how she sees herself today. https://t.co/m4RtlctlsO",0,0,No,en,no media
1393270994211590147,2021-05-14 18:24:25+00:00,"You're absolutely justified if you have a LOT of questions. Here, experts answer all of them. https://t.co/Ba5jQrC71v",0,1,No,en,no media
1393257265352908801,2021-05-14 17:29:52+00:00,"""The magic of these comics is that they are the unspoken thoughts."" https://t.co/qOJDGzn6dq",1,0,No,en,no media
1393245824184983558,2021-05-14 16:44:24+00:00,Sometimes people do change their minds. Here's why these individuals eventually got their COVID-19 shots. https://t.co/gLuCcaK5Hf,1,4,No,en,no media
1393228098615881733,2021-05-14 15:33:58+00:00,"""My toddler threw a clipboard at me.This is no way for a boss to treat an unpaid intern."" https://t.co/midRzAKc7a",1,0,No,en,no media
1393197562828578819,2021-05-14 13:32:37+00:00,"""When you ban my book, you’re telling me that a child like mine doesn’t belong in your schools or your communities."" https://t.co/Eqn26foZOv",0,0,No,en,no media
1393166954807103490,2021-05-14 11:31:00+00:00,Now Kroger is closing stores where communities are requiring hazard pay. https://t.co/Ykz3SEisYS,0,1,No,en,no media
1393154215174975490,2021-05-14 10:40:23+00:00,"Yes, there's a difference between emergency use authorization and approval. No, it shouldn't stop anyone from getting COVID-19 shots. https://t.co/6eFSLIDrHE",1,2,No,en,no media
1393146593428316164,2021-05-14 10:10:05+00:00,"The actor and her husband, Andrew Upton, have three sons and a daughter. https://t.co/IdujnLm8nz",0,0,No,en,no media
1393138140790075393,2021-05-14 09:36:30+00:00,"The Hernando de Soto Bridge, which connects Tennessee to Arkansas, has been closed to traffic since Tuesday. https://t.co/YhnFObqPsN",15,4,No,en,no media
1393130231800729602,2021-05-14 09:05:05+00:00,Health Commissioner Thomas Farley was forced to resign after cremating victims' remains from the 1985 police attack instead of returning them to family. https://t.co/8gnlVyHleu,1,1,No,en,no media
1393118545668624385,2021-05-14 08:18:38+00:00,A former aide to Colorado Rep. Doug Lamborn said he was fired for “seeking to protect employees from unsafe conditions.” https://t.co/7yJsQr8nLz,0,0,No,en,no media
1393098927667355650,2021-05-14 07:00:41+00:00,You've goo goo ga got to check out these reviewer-favorite baby-proofing solutions. https://t.co/DlHjHfv500,0,0,No,en,no media
1393085677366128640,2021-05-14 06:08:02+00:00,American Federation of Teachers President Randi Weingarten said schools should be open for in-person teaching in the fall. https://t.co/whfiFSsYOZ,1,0,No,en,no media
1393070371839123463,2021-05-14 05:07:13+00:00,"Gleyber Torres was not only vaccinated, but he contracted the coronavirus during the off season. https://t.co/GHm1ByNJBD",0,0,No,en,no media
1393059977321975809,2021-05-14 04:25:55+00:00,"“Gasoline supply is coming back online,” he said of the Colonial Pipeline after a ransomware attack. “Panic-buying will only slow the process.” https://t.co/PoTlOU08Kd",1,1,No,en,no media
1393049826737205248,2021-05-14 03:45:34+00:00,"Here's how the remark can backfire, and what to say when addressing mental health instead. https://t.co/tzQiXOat8T",4,1,No,en,no media
1393038938944720897,2021-05-14 03:02:19+00:00,"Convertible cribs, jogging strollers and more baby goods you'll love for your bundle of joy. https://t.co/DYiTq0AMKf",0,0,No,en,no media
1393023148166111236,2021-05-14 01:59:34+00:00,The fast-food giant is also encouraging its franchisees — which make up 95% of its restaurant base — to boost pay. https://t.co/KbX9xiq62D,1,0,No,en,no media
1393006610507763716,2021-05-14 00:53:51+00:00,"The Duke of Sussex spoke with Dax Shepard on ""Armchair Expert"" about his life, which he compared to being in ""The Truman Show"" and a zoo. https://t.co/c0NMSfgjlI",0,0,No,en,no media
1392997422956220417,2021-05-14 00:17:20+00:00,"""She's 3, and she's really flexing right now,"" the actor and writer joked about her daughter, Katherine. https://t.co/DQGpNzfRkK",1,0,No,en,no media
1392988600564920322,2021-05-13 23:42:17+00:00,"""Found my missing cardigan when my sister posted a FB pic of her wearing it."" https://t.co/V6xlSYRaiV",2,0,No,en,no media
1392977669306949633,2021-05-13 22:58:51+00:00,"Incognito mode aside, it was a surprisingly normal outing for the Duke and Duchess of Sussex. https://t.co/DuitHBse5n",4,1,No,en,no media
1392966770529611779,2021-05-13 22:15:32+00:00,"Now that fully vaccinated people can safely stop wearing masks in most situations, Americans have some other guidelines the CDC should consider. https://t.co/HhHIBmoVY8",0,0,No,en,no media
1392948332209872900,2021-05-13 21:02:16+00:00,Science saved my daughter's life. Then another fear took hold. https://t.co/SCPVvmm9ie,0,0,No,en,no media
1392917693339156483,2021-05-13 19:00:31+00:00,“What made Bruce especially impactful was his timing. There simply was no one like him ever before.” #APAHM https://t.co/WCTYaxpPVY,2,1,No,en,no media
1392903994843045888,2021-05-13 18:06:05+00:00,The Brooklyn-based mental health advocate is creating space on Instagram to honor the spirit of radical resistance and the collective healing of her Afro-Puerto Rican ancestors. https://t.co/h7T6aEv8fp,1,0,No,en,no media
1392881889770409988,2021-05-13 16:38:15+00:00,"“It encourages the AAPI population to seek treatment when already they’re the least likely to go."" #APAHM https://t.co/w71WScGkTe",1,1,No,en,no media
1392851148864905217,2021-05-13 14:36:06+00:00,Here are some sneakerhead-backed tips for investing in a pair of trendy sneakers. https://t.co/gOsf82a2Gc,1,0,No,en,no media
1392820778526203906,2021-05-13 12:35:25+00:00,Here's what to do when you want to convince your boss to let you stay remote post-COVID-19. https://t.co/TsABJd8GQs,2,1,No,en,no media
1392789976144912384,2021-05-13 10:33:01+00:00,"Eggs, pizza, steak, French fries — what to do? (Hint: You may want to buy an air fryer.) https://t.co/gWtmtXlyOA",5,0,No,en,no media
1392778546846765058,2021-05-13 09:47:36+00:00,"Whether you're dealing with depression, anxiety or a case of the baby blues, these tips can help make the transition to motherhood more manageable. https://t.co/iRNMyzyMV4",1,0,No,en,no media
1392746912978284547,2021-05-13 07:41:54+00:00,Students are learning from home through Friday because many bus drivers have been quarantined because of COVID-19 exposure and there aren’t enough substitutes. https://t.co/bAlC4kbZ6R,0,0,No,en,no media
1392730369670193152,2021-05-13 06:36:10+00:00,From baby-proofing products to useful gadgets — we've found a selection of budget-friendly items that are genuinely useful. https://t.co/HPC6Uhz8Aj,0,0,No,en,no media
1392716670851035139,2021-05-13 05:41:44+00:00,Feeling stressed or down? These science-backed tips will boost your mood quickly. https://t.co/KbcFkVOeBW,2,0,No,en,no media
1392708116043677702,2021-05-13 05:07:44+00:00,"Sure, all your friends are gonna be jealous of your incredible place. But you don't have to ~dwell~ on that. https://t.co/GIeWLkFnga",1,0,No,en,no media
1392700116839055360,2021-05-13 04:35:57+00:00,Travel experts share the missteps they're observing as people wade back into tourism. https://t.co/d92CrlSJ1z,1,0,No,en,no media
1392691772032274439,2021-05-13 04:02:48+00:00,Steven LaTulippe's patients said they were instructed to remove their masks when entering his clinic and were told that masks could cause carbon dioxide toxicity. https://t.co/epVTvTx74w,1,0,No,en,no media
1392683948715696131,2021-05-13 03:31:42+00:00,Universal jar opener &gt; yelling at a stubborn jar of tomato sauce for a half-hour. https://t.co/80vFMJjcyH,2,0,No,en,no media
1392674706139009028,2021-05-13 02:54:59+00:00,"Whether you have FODO or JODO (that's joy of dining out), these tips will help you stay safe. https://t.co/HWFgCeDzfO",2,1,No,en,no media
1392665747864920065,2021-05-13 02:19:23+00:00,Some shelters say people are returning their 'COVID pets' as they go back to work. Here are more compassionate things to do before considering that option. https://t.co/ZxZZ9a1JoA,1,1,No,en,no media
1392657072609693699,2021-05-13 01:44:55+00:00,"""Sleep training children is a type of hazing."" https://t.co/39PmtEPMd1",0,0,No,en,no media
1392648823957299202,2021-05-13 01:12:08+00:00,"The waiver's timing and scope, plus the transfer of technological know-how and development of manufacturing infrastructure, will all be fiercely debated. https://t.co/NnGuTM32V7",0,0,No,en,no media
1392631720596418561,2021-05-13 00:04:10+00:00,"Eyeshadow shields, redness-canceling moisturizer and cat-eye eyeliner stamps are here to save the day. https://t.co/0Fl8wZNvJX",0,0,No,en,no media
1392619071238295553,2021-05-12 23:13:54+00:00,"The end of your long quest to fix eye puffiness, foggy mask glasses and foot pain is just a few clicks away. https://t.co/lZUofoKqkF",1,1,No,en,no media
1392600836229013508,2021-05-12 22:01:27+00:00,Experts share some red flags of this common perinatal mood disorder. https://t.co/OPB1bdHhtp,0,1,No,en,no media
1392592931089965064,2021-05-12 21:30:02+00:00,"These items for your eyebrows, hair, nails, skin and more are about to be your new BFFs. https://t.co/BFFdN0V3gV",0,1,No,en,no media
1392578860471013380,2021-05-12 20:34:07+00:00,Pleasure yourself with these discreet vibrators that'll hit all the right spots but not make a lot of noise. https://t.co/vZP3u1TeSV,2,0,No,en,no media
1392564200195637249,2021-05-12 19:35:52+00:00,"After a year of DIY haircuts and hacks, it's time to go for the chop. https://t.co/4MpNZJcYxN",1,0,No,en,no media
1392541445417062405,2021-05-12 18:05:27+00:00,"""The trauma of being rejected because of your weight so many times creeps in, no matter how confident you are in yourself."" https://t.co/g8I2ii8eiC",2,1,No,en,no media
1392513985145098243,2021-05-12 16:16:20+00:00,"“I want to create a world that is reflective of all of us,” the disability activist said. #APAHM https://t.co/FYEtECN1IU",3,1,No,en,no media
1392500372665679877,2021-05-12 15:22:14+00:00,Leftover pizza four nights in a row? Don't mind if I do! https://t.co/Ntq4ACSAgE,1,0,No,en,no media
1392482703837106181,2021-05-12 14:12:02+00:00,"Ombre vibrators, double-sided dildos and more amazing sex toys for added thrills. https://t.co/3mKE1DNdXI",0,0,No,en,no media
1392471402142388227,2021-05-12 13:27:07+00:00,Postpartum depression may last far longer than doctors and patients ever realized. https://t.co/C52i1IZLJC,1,1,No,en,no media
1392446614711717890,2021-05-12 11:48:38+00:00,The cookbook author sheds light on harsh business realities in the AAPI community -- and shares what we can do to help. https://t.co/rzJaLeaQIX,0,0,No,en,no media
1392416386249641985,2021-05-12 09:48:30+00:00,"We break it all down, from the difference between physical and mineral to whether SPF 100 is really much stronger than SPF 30. https://t.co/T2r2V8coYL",1,0,No,en,no media
1392380461712920580,2021-05-12 07:25:45+00:00,“All I Know So Far” takes a backstage look at the Grammy winner's Beautiful Trauma World Tour. It's due out May 21 on Amazon Prime. https://t.co/bi7lyuVxCf,0,0,No,en,no media
1392350246492069888,2021-05-12 05:25:42+00:00,"“We have to make it easier and more convenient for all Americans to get vaccinated,” President Joe Biden said. https://t.co/eXrhxakqpv",1,1,No,en,no media
1392326219593551873,2021-05-12 03:50:13+00:00,A new report from the Institute for Policy Studies found that low-wage companies tweaked compensation rules to boost executive pay. https://t.co/1fS0HSJKbM,1,0,No,en,no media
1392295273288945669,2021-05-12 01:47:15+00:00,"When her peers were listening to nursery rhymes, Michelle Rasul was hooked on was hooked on rap legends like Tupac Shakur, Jay-Z, and the Notorious B.I.G. https://t.co/lpgi4Yftqe",0,0,No,en,no media
1392274500398485506,2021-05-12 00:24:42+00:00,"""We haven’t met each other’s friends ... or done many of the other things couples do during and after a year of dating."" https://t.co/nQ5I3LEaKt",2,0,No,en,no media
1392265259575021572,2021-05-11 23:47:59+00:00,"As the vaccine rollout continues for children, misinformation is swirling more than ever. Here's what parents need to know. https://t.co/QwDqylU4k7",0,1,No,en,no media
1392247538942726146,2021-05-11 22:37:34+00:00,These comics capture the silent struggle of postpartum depression and anxiety. https://t.co/XCFGS6ZQp9,12,3,No,en,no media
1392222656259297288,2021-05-11 20:58:42+00:00,"""Love him madly,"" the ""Chicago Med"" actor gushed on Instagram. https://t.co/vH49sR9tbs",0,0,No,en,no media
1392201093170536451,2021-05-11 19:33:01+00:00,"""How to have sex"" is the most-searched sex question on Google. Here's how you can get past your nerves and get busy post-vaccine. https://t.co/MlN9iKDcvC",0,0,No,en,no media
1392192862050295809,2021-05-11 19:00:18+00:00,Any of these reads is sure to make your child curious about a world beyond their own. #APAHM https://t.co/abpW7YK3wd,1,0,No,en,no media
1392183038520569862,2021-05-11 18:21:16+00:00,"""Senator Paul, with all due respect, you are entirely and completely incorrect,"" the infectious disease expert said. https://t.co/RKOZmAfW3Z",0,0,No,en,no media
1392170407575314443,2021-05-11 17:31:05+00:00,"Minimize acne, irritation, dryness and more complexion annoyances with these skin savers. https://t.co/76WUeaPjID",1,0,No,en,no media
1392140247635480579,2021-05-11 15:31:14+00:00,Experts break down the ethical and logistical considerations before you cut loose by traveling abroad. https://t.co/8RhRgkBZL5,1,0,No,en,no media
1392115537656881164,2021-05-11 13:53:03+00:00,"Jiangshi: Blood in the Banquet Hall, a new role-playing game by Banana Chan and Sen-Foong Lim, tackles racism, history and mythology all at once. #APAHM https://t.co/Lu3uNOhU9I",0,0,No,en,no media
1392084744452591621,2021-05-11 11:50:41+00:00,Career experts weigh in on whether workers can give less time than the usual resignation notice. https://t.co/u3kDCRtkXJ,1,0,No,en,no media
1392077054561169410,2021-05-11 11:20:08+00:00,"Taste is subjective, but there's science to prove flavors and textures really do change as chemistry does its work. https://t.co/sj1xAzK0lR",1,0,No,en,no media
1392064665811828739,2021-05-11 10:30:54+00:00,"""Makeup tip: For clump-free application of mascara do not apply mascara."" https://t.co/F5NrZr0JLD",1,0,No,en,no media
1392056065223798784,2021-05-11 09:56:43+00:00,Many claim the supplement can do everything from treat acne to prevent cancer. Here's what you should know. https://t.co/XSLdFPWPPA,1,1,No,en,no media
1391988666180964352,2021-05-11 05:28:54+00:00,"With Welcome to Chinatown, co-founder Vic Lee offers support for New York’s Asian American community as it navigates inequities exacerbated by the pandemic. https://t.co/UW09Gf5y7k",3,1,No,en,no media
1391958186727518208,2021-05-11 03:27:47+00:00,Reporting on perinatal mental health helped me enormously when I became a mom. But there's still so much we need to do to support new parents. https://t.co/V7ej2MFxu4,2,0,No,en,no media
1391939415707115528,2021-05-11 02:13:12+00:00,"""It’s so cute when Gen Z tries to insult us millennials. We had metal slides and lawn darts, you can’t touch us."" https://t.co/MrccJlRQ97",3,1,No,en,no media
1391928087445651462,2021-05-11 01:28:11+00:00,"The Federal Aviation Administration as many as a dozen passengers could pay fines as high as $30,000 for interfering with airline crews. https://t.co/mKAyiC8tcW",0,0,No,en,no media
1391919300361994245,2021-05-11 00:53:16+00:00,"The ""Handmaid's Tale"" star and her wife of nearly four years had kept the pregnancy under wraps prior to the Mother's Day announcement. https://t.co/H4TGuYRSzl",4,0,No,en,no media
1391908889109598210,2021-05-11 00:11:54+00:00,A new generation of superheroes are at the forefront of a popular drama. https://t.co/JGnED8AAD0,0,0,No,en,no media
1391900653979570182,2021-05-10 23:39:10+00:00,The Duke of Sussex's Apple TV+ series with Oprah Winfrey will feature NBA players and stars like Lady Gaga and Glenn Close. https://t.co/T6oVS8eRQt,4,4,No,en,no media
1391885488072667136,2021-05-10 22:38:54+00:00,The COVID-19 vaccine is the first to be authorized for kids under age 16 in the U.S. https://t.co/AvzXpBFWWF,0,2,No,en,no media
1391875933318090753,2021-05-10 22:00:56+00:00,News of the comedian’s split comes about three months after he completed a 60-day rehab program to deal with cocaine and alcohol abuse. https://t.co/fZJgNzthOO,0,0,No,en,no media
1391852314059759625,2021-05-10 20:27:05+00:00,The story of a Harlem honors student whose life changes when he’s charged with murder is one of the top movies on Netflix right now. https://t.co/rNzDev7TnU,0,0,No,en,no media
1391833319327817736,2021-05-10 19:11:36+00:00,NEW: NBC said it will not air the 2022 Golden Globe Awards due to ongoing controversy with the Hollywood Foreign Press Association. https://t.co/e99WmO2chq,0,0,No,en,no media
1391830457298399234,2021-05-10 19:00:14+00:00,"Filipino American farmers on Bainbridge Island, Washington, cared for the properties of their Japanese American neighbors during World War II. Their bonds still exist today. #APAHM https://t.co/s5CsPTia0r",1,1,No,en,no media
1391806996853166081,2021-05-10 17:27:01+00:00,"If you're struggling to focus lately (who isn't?), try one of these tips to improve your stress and sharpen your mind. https://t.co/96EPH0wiYV",3,1,No,en,no media
1391792805903839242,2021-05-10 16:30:37+00:00,Romanian doctors are offering a jab in the arm rather than a stake through the heart. https://t.co/66Dq0tFhW5,2,1,No,en,no media
1391783370158444550,2021-05-10 15:53:08+00:00,"The comedian and his wife, Christina Evangeline, have two children. https://t.co/HUcuhEX5jr",0,0,No,en,no media
1391752579655286784,2021-05-10 13:50:47+00:00,"""In my mind, I had been given the choice of continuing to hide and be invisible, or to be wanted and desired — and I chose the latter, every time."" https://t.co/XEA65g2hFX",0,0,No,en,no media
1391721923684544518,2021-05-10 11:48:58+00:00,"Money, mold, monotony — they all play a role in your attitude about leftover food. https://t.co/rwDrmsI0qH",1,0,No,en,no media
1391691451495505920,2021-05-10 09:47:53+00:00,"Here are some expert-recommended beauty basics for looking polished with minimal effort, from multitasking tints to light foundations. https://t.co/ZG22COXwYP",0,0,No,en,no media
1391499630266011648,2021-05-09 21:05:39+00:00,"A police union complained to the school district that the book ""Ghost Boys"" is anti-police “propaganda.” https://t.co/1N1BRiMdTK",1,1,No,en,no media
1391437967516909568,2021-05-09 17:00:37+00:00,"A recent study counted 905,000 coronavirus deaths in the U.S., nearly double the amount recorded by federal health officials. https://t.co/FnoDbcRW7Q",2,1,No,en,no media
1391407732369072129,2021-05-09 15:00:29+00:00,"For an expectant mom in labor, one of the most supportive forces in the delivery room is often her own mother. https://t.co/pVWoWRjVAK",2,1,No,en,no media
1391392998987083777,2021-05-09 14:01:56+00:00,"""This Mother’s Day I would like a very cold hotel room, black out curtains, an Ambien, and no other human being present. Thank you in advance."" https://t.co/3Uy5vyFvui",4,0,No,en,no media
1391362390181228549,2021-05-09 12:00:18+00:00,Happy Mother's Day! https://t.co/wPx0pJWlZd,2,0,No,en,no media
