id,created_at,text,favorite_count,retweet_count,is_retweet,language,media_type
1466470432270344193,2021-12-02 18:12:51+00:00,"The former ""Bachelor"" confirmed this week that he and Brown, a political strategist, have been in a relationship for several months. https://t.co/syicVUJbo3",0,0,No,en,no media
1466466629395619856,2021-12-02 17:57:44+00:00,The Women’s Health Protection Act would outlaw hundreds of state anti-abortion laws — but passing it would likely require eliminating the Senate filibuster. https://t.co/SiVXJxRfmS,0,0,No,en,no media
1466452294728306701,2021-12-02 17:00:47+00:00,"The Republican congressman from Ohio is spouting nonsense that ignores data, experts and the reality of the newest coronavirus variant. https://t.co/RH21zth5xB",0,0,No,en,no media
1466407455399809026,2021-12-02 14:02:36+00:00,"""My religious identity and commitment to reproductive autonomy are deeply intertwined."" https://t.co/U6urdXAHH9",1,1,No,en,no media
1466376671590817796,2021-12-02 12:00:17+00:00,"Nothing's worse than a house full of junky, obnoxious toys. We've got the ultimate list of kid gifts that are aesthetically pleasing and, most importantly, quiet. https://t.co/RgULrtBkdB",0,0,No,en,no media
1466373012106747904,2021-12-02 11:45:44+00:00,"Give the ultimate gift of alone time with these items, which range from book memberships to contact-free meal services. https://t.co/zc8VEyqCxR",1,0,No,en,no media
1466369220292263940,2021-12-02 11:30:40+00:00,"Jewelry, bath products, leather goods and more, all from Latinx-owned brands. https://t.co/2A4flYy01w",0,0,No,en,no media
1466365431791468544,2021-12-02 11:15:37+00:00,Here's how to prevent it from happening in the first place — and also how to stop it in its tracks once it starts. https://t.co/aoGqyq9Xbe,0,0,No,en,no media
1466361645228298246,2021-12-02 11:00:34+00:00,"Supplements and topicals claim to prevent or even recolor the natural pigment of your hair, but here's what experts say. https://t.co/INTBsjwGQ8",0,0,No,en,no media
1466357848145903616,2021-12-02 10:45:29+00:00,"Unique vinyl coasters, fun trivia cards and delicious food finds make for great anonymous gifting. https://t.co/31CnFkmBNx",0,0,No,en,no media
1466346616168882177,2021-12-02 10:00:51+00:00,"Starting in mid-January, people will be able to get the cost of at-home COVID-19 tests reimbursed by their private health insurance. https://t.co/WHCqxFh6NW",0,0,No,en,no media
1466271293972660225,2021-12-02 05:01:33+00:00,"Months after the state enacted a six-week abortion ban, another bill went into effect largely cutting off Texans' remaining access to abortion care. https://t.co/HWcycr6LUp",0,0,No,en,no media
1466248199358894082,2021-12-02 03:29:46+00:00,The first U.S. case of the omicron variant has been confirmed in California. https://t.co/wnIeCyi9C5,0,0,No,en,no media
1466217330506043403,2021-12-02 01:27:07+00:00,"Have a bad or funny office holiday party story? We want to hear all about bad DJs, awkward co-worker interactions, drunk bosses and corporate fails. Email monica.torres@huffpost.com with your story. It could be used in an upcoming piece. You can choose to remain anonymous.",0,0,No,en,no media
1466216399907573764,2021-12-02 01:23:25+00:00,Want to improve communication with your partner? Avoid these damaging phrases. https://t.co/kNNnPnLCMU,1,0,No,en,no media
1466205795016744960,2021-12-02 00:41:16+00:00,"“I have to think about what they’re going to experience leaving the home,” the ""Unforgivable” star said. https://t.co/6goGcEUMma",1,0,No,en,no media
1466160326576119811,2021-12-01 21:40:36+00:00,"Here's what's new, from the omicron variant to updated booster guidance. https://t.co/nljs7rRNry",0,0,No,en,no media
1466156536032546818,2021-12-01 21:25:32+00:00,"""I don't need Spotify Wrapped to tell me my top songs are all bangers from Daniel Tiger."" https://t.co/9LPHuOEK3b",0,0,No,en,no media
1466152739331846147,2021-12-01 21:10:27+00:00,The president was blunt when a reporter asked him about sharing a debate stage with Trump after his rival had reportedly tested positive for COVID-19. https://t.co/mY1OovkXDn,0,1,No,en,no media
1466148941469208582,2021-12-01 20:55:22+00:00,The justices appeared primed to overturn Roe v. Wade. https://t.co/q1w9dTIMtX,0,1,No,en,no media
1466134146007379970,2021-12-01 19:56:34+00:00,Mark Meadows revealed in his book that the former president had first tested positive for the coronavirus nearly a week before he admitted it. https://t.co/dFcC9VXwZ2,2,1,No,en,no media
1466121894176989188,2021-12-01 19:07:53+00:00,"Nearly 20 countries have recorded the variant, triggering travel bans across the world. https://t.co/SbbZdgqymy",0,1,No,en,no media
1466118097123872782,2021-12-01 18:52:48+00:00,The new COVID-19 variant was first identified by researchers in South Africa. https://t.co/dJxVsfIPsG,0,0,No,en,no media
1466083327069274119,2021-12-01 16:34:38+00:00,A series of injunctions have held up key components of the president’s vaccination campaign in court. https://t.co/DOd5vb5Q57,0,0,No,en,no media
1466074230383067144,2021-12-01 15:58:29+00:00,Will we need new shots because of the omicron variant or any other future strains? Here's what we know right now. https://t.co/pTKrcnv1TW,1,0,No,en,no media
1466057810391748617,2021-12-01 14:53:14+00:00,Abloh was known for pushing boundaries as the head of the legendary French fashion house. https://t.co/CfWYIz5Mrx,1,0,No,en,no media
1466044552175919109,2021-12-01 14:00:33+00:00,"""'Don’t tell anyone,' he said next. 'Why not?' I asked. 'We have to protect the kids. They can’t know. The town can’t know.''' https://t.co/nORnuX5Zhj",0,0,No,en,no media
1466014268566949893,2021-12-01 12:00:13+00:00,"Jade rollers, friendship rings and wine on delivery may help mend your friend's broken heart. https://t.co/3EnAJ1FZ2f",0,0,No,en,no media
1466010602476822529,2021-12-01 11:45:39+00:00,"Noise-canceling headphones, seam-free clothing, engaging activities and more gift ideas for children who may experience sensory under- or overload. https://t.co/uFkRQnJNYi",4,1,No,en,no media
1466006816513482752,2021-12-01 11:30:36+00:00,"""Titanic"" and ""What’s Eating Gilbert Grape"" are among the movies and shows departing the streaming platform this month. https://t.co/OtArGFLsMi",0,0,No,en,no media
1466003028503416837,2021-12-01 11:15:33+00:00,"From dolls with naturally curly hair to reimagined fairytale books, these products will create toy chests that match real life. https://t.co/teuECGUu6t",0,0,No,en,no media
1465999238836404244,2021-12-01 11:00:30+00:00,Nutritionists weigh in on everything from peppermint mochas to gingerbread lattes. https://t.co/B5cuWt8Sp3,0,0,No,en,no media
1465995449555378181,2021-12-01 10:45:26+00:00,Velvet suits are all over the red carpet these days. Here's how to bring them into your wardrobe. https://t.co/JHDxm4XD1u,2,1,No,en,no media
1465899620308066308,2021-12-01 04:24:39+00:00,Tests within 24 hours of departure and even self-quarantine rules are all reportedly on the table amid the spread of the omicron variant. https://t.co/apZeGLXCRj,2,0,No,en,no media
1465808486185553929,2021-11-30 22:22:31+00:00,Get the deal on Amazon before it's gone. https://t.co/cXyNIvY8Ib,0,0,No,en,no media
1465785611768508421,2021-11-30 20:51:37+00:00,What's different about the new COVID strain compared to others like delta? Here's what you need to know. https://t.co/2J32ufGkyF,0,0,No,en,no media
1465718777958604807,2021-11-30 16:26:03+00:00,help me out! https://t.co/kyFxCIRK8D,0,3,Yes,en,photo
1465683018073485316,2021-11-30 14:03:57+00:00,"""He always shows up when I least expect it ― and I really should expect it by now."" https://t.co/uqEjr23Nih",0,0,No,en,no media
1465682033204609037,2021-11-30 14:00:02+00:00,"Have a memorably bad or funny office holiday party story? We want to hear all about bad DJs, awkward co-worker interactions, drunk bosses and corporate fails. Email monica.torres@huffpost.com with your story. It could be used in an upcoming piece. https://t.co/ZdVMJ6NqBN",1,0,No,en,photo
1465679229354491910,2021-11-30 13:48:53+00:00,Dutch health authorities said the coronavirus variant was found in samples taken before South Africa first reported the variant to the World Health Organization. https://t.co/AMBb4lJVYF,0,0,No,en,no media
1465640620848988162,2021-11-30 11:15:28+00:00,"Find the perfect custom gift with these offerings, from headphone stands to fun socks with the recipient's face on them. https://t.co/2p1tJeoDeg",2,0,No,en,no media
1465636832016846855,2021-11-30 11:00:25+00:00,"Inflation rates are setting records, but mentioning it to your boss in a negotiation is tricky. https://t.co/RGSIikCpq7",0,1,No,en,no media
1465633040479236097,2021-11-30 10:45:21+00:00,Read this if you're constantly jumping to the worst-case scenario when you're anxious. https://t.co/fYPb676nK7,0,0,No,en,no media
1465491386694832133,2021-11-30 01:22:28+00:00,"Some lifelong singles say they're on their own by choice, while others are actively looking for love. https://t.co/6WX72ETdkl",0,1,No,en,no media
1465481922004627459,2021-11-30 00:44:52+00:00,"""I promise you it will go away if you just keep at it,"" Biden assured a girl while vacationing in Nantucket. https://t.co/VU4dk10OHQ",0,0,No,en,no media
1465449224036827136,2021-11-29 22:34:56+00:00,"“Many of us might think we are done with COVID-19. It’s not done with us,” World Health Organization director-general Tedros Adhanom Ghebreyesus said Monday. https://t.co/0zVxXgjpJj",2,0,No,en,no media
1465439496690966530,2021-11-29 21:56:17+00:00,"""I’m considering polygamy so someone else can answer my husband’s questions mid-movie."" https://t.co/dCIVMALATn",1,0,No,en,no media
1465408551401275395,2021-11-29 19:53:19+00:00,"For one day only, you can save big on Apple MacBook Airs and MacBook Pros. https://t.co/Y55Jukh7YN",0,0,No,en,no media
1465395549448937472,2021-11-29 19:01:39+00:00,"The U.S. will “face this new threat just as we’ve faced those that have come before it,” President Joe Biden said. https://t.co/IQk3BdwPW3",0,0,No,en,no media
1465391750009311234,2021-11-29 18:46:33+00:00,"""I am so grateful to officially call her mine,"" the fitness guru and former ""Biggest Loser"" coach said of her new fiancée. https://t.co/8hkBmw3dck",3,1,No,en,no media
1465386697835827204,2021-11-29 18:26:28+00:00,"Experts predict how the new COVID variant first identified in South Africa may affect vaccines, the pandemic and more. https://t.co/0O6l1I2uOb",0,0,No,en,no media
1465380889899245571,2021-11-29 18:03:24+00:00,"Get all the good deals on gifts for the kiddos with some super savings at Gap, Disney, Crayola, Wayfair and more. https://t.co/VS51PIs3P2",0,0,No,en,no media
1465377079906734092,2021-11-29 17:48:15+00:00,"Time to save some money on big-name brands like Samsung, Dyson, Bose, Foreo, and more, today only https://t.co/ZqtJKMT3mi",0,0,No,en,no media
1465361781489119237,2021-11-29 16:47:28+00:00,"""I’m here to experience my body for once without analyzing it."" https://t.co/5fiERwj8qU",1,0,No,en,no media
1465357981625823241,2021-11-29 16:32:22+00:00,"Get an ExpertClean Bluetooth toothbrush that connects with the Sonicare App on sale, today only. https://t.co/TAHdu836fF",0,0,No,en,no media
1465341810314723329,2021-11-29 15:28:06+00:00,Get the highly rated 3-in-1 styling tool today at a super discounted price. https://t.co/FWTZDr3zhi,0,0,No,en,no media
1465338020400357386,2021-11-29 15:13:03+00:00,"From Dutch ovens to cheesecloth and the right thermometer, these kitchen must-haves will help you make delicious fried food. https://t.co/tePHMSS5tL",0,0,No,en,no media
1465324638570000391,2021-11-29 14:19:52+00:00,"Hulu, Peacock, Amazon Prime, AMC Plus and more are all at a heavy discount right now. https://t.co/E2ZeZbMMPL",0,1,No,en,no media
1465320848362029059,2021-11-29 14:04:49+00:00,"Lookups for “vaccine” increased 601% over 2020. It was also extremely high every day in 2021, the publishing company said. https://t.co/MMnGPYk6yA",0,0,No,en,no media
1465317059018080261,2021-11-29 13:49:45+00:00,Save big on these deals from NordicTrack and even bikes you can use under your desk while you work from home. https://t.co/ce5DQcDCyQ,0,0,No,en,no media
1465306203832127489,2021-11-29 13:06:37+00:00,"From now until Dec. 18, take up to 30% off these popular Roomba robot vacuums. https://t.co/YwoE1v1QCr",0,0,No,en,no media
1465302413603221509,2021-11-29 12:51:34+00:00,"Now through Dec. 4, save up to almost $400 on cookware from Instant Pot, Vitamix, Calphalon and more. https://t.co/GeLe5pnPJ7",0,1,No,en,no media
1465298625039409152,2021-11-29 12:36:30+00:00,"Find over 60% off on well known brands, BOGO deals and exclusive free gifts in this definitive Cyber Week guide. https://t.co/3CcFwrT9L0",0,0,No,en,no media
1465274409858576398,2021-11-29 11:00:17+00:00,"BOGO deals, site-wide sales and 70% off promo codes reign supreme during this year's Cyber Week style offerings. https://t.co/otjj1x3mKN",1,0,No,en,no media
1465270740836655105,2021-11-29 10:45:42+00:00,"For years, anti-choice activists and politicians have attacked reproductive rights in Mississippi. Dobbs v. Jackson Women’s Health is the endgame. https://t.co/tcxnUw7voS",1,0,No,en,no media
1465229216216141824,2021-11-29 08:00:42+00:00,"The top seasonal songs of the year, from the best-known artists to indie acts. https://t.co/gj72TrkYm8",0,0,No,en,no media
1465149761342816260,2021-11-29 02:44:58+00:00,"GOP Rep. Ronny Jackson insisted that the highly transmissible variant is just a trick to ""push"" midterm mail-in ballots. https://t.co/yhxRWlqXXL",0,0,No,en,no media
1465046318028623874,2021-11-28 19:53:56+00:00,Abloh was the men’s wear designer of Louis Vuitton. https://t.co/SLJq6iJLHu,3,2,No,en,no media
1465037110088540160,2021-11-28 19:17:20+00:00,"He said the COVID-19 variant will ""inevitably"" come to the U.S. if it is not already here and warned that it is ""going to have an advantage in transmissibility."" https://t.co/6Rzdh0Ge8E",1,1,No,en,no media
1464982969345523719,2021-11-28 15:42:12+00:00,Video posted online appears to show the man sitting on the tarmac after his precarious ride that authorities say very few survive. https://t.co/v6aJsNb19m,0,0,No,en,no media
1464968464863535112,2021-11-28 14:44:34+00:00,Officials later confirmed that 13 had the omicron variant. https://t.co/L2TB5nTpri,3,0,No,en,no media
1464714245845700614,2021-11-27 21:54:23+00:00,The actors welcomed their toddler in the spring of 2020. https://t.co/TWaf3qxn5H,1,0,No,en,no media
1464647641720102919,2021-11-27 17:29:44+00:00,"The virus has been described as a ""variant of concern"" by WHO officials. https://t.co/SD8YANts2a",0,0,No,en,no media
1464599806383468544,2021-11-27 14:19:39+00:00,"“As a child, I assumed my Koreanness just fell away like a snake shedding its skin. I thought, 'That must be what happens when you’re adopted.'” https://t.co/roSFwfLyVe",0,0,No,en,no media
1464596019086307329,2021-11-27 14:04:36+00:00,There's something weird for everyone in our annual holiday gift guide. Who wouldn't love musical toilet paper or cellphone-shaped cheese? https://t.co/v8grWrdLP4,0,0,No,en,no media
1464592227242594308,2021-11-27 13:49:32+00:00,The new COVID-19 variant was identified in South Africa two weeks ago. https://t.co/NZncyoIB6n,0,1,No,en,no media
1464576839985344521,2021-11-27 12:48:23+00:00,"Take a peek at some of the best home, fitness, beauty and fashion deals available this Cyber Week. https://t.co/JFGHwEGWov",0,0,No,en,no media
1464499508067377153,2021-11-27 07:41:06+00:00,"""While the new omicron variant has yet to be detected in New York, it’s coming,” warned Gov. Kathy Hochul. https://t.co/a1Ho9cpFO8",3,2,No,en,no media
1464352711055446020,2021-11-26 21:57:47+00:00,"The couple, who also share two sons, named the third child Adelaide after Meyers' maternal grandmother. https://t.co/GRZmcHOG4W",2,0,No,en,no media
1464325217959006210,2021-11-26 20:08:32+00:00,"Save hundreds on must-have items from brands like Apple, Samsung, Dyson, Bose and more. https://t.co/h0Bskc8kuf",1,1,No,en,no media
1464317645755461635,2021-11-26 19:38:27+00:00,"From super-soft sheets to mixers to teeth whitening products, it's good to save a bunch on things you actually use. https://t.co/148AWLvfPH",1,1,No,en,no media
1464309822082502659,2021-11-26 19:07:21+00:00,The omicron strain circulating around South Africa has been flagged as a variant of concern. https://t.co/gYAnXgxMSg,0,0,No,en,no media
1464305900710248451,2021-11-26 18:51:46+00:00,The World Health Organization has declared omicron a variant of concern. https://t.co/Zkzm9fqb2F,1,2,No,en,no media
1464273337824292867,2021-11-26 16:42:23+00:00,Here's what's best to buy on Black Friday vs. Cyber Monday.  https://t.co/lEhnaefpwv,0,0,No,en,no media
1464272702798237714,2021-11-26 16:39:51+00:00,"We did the hard work for you. Shop Black Friday sales on everything from home décor, kitchen gadgets, beauty, fitness and more. https://t.co/UQ59w27M0m",0,0,No,en,no media
1464272442743001106,2021-11-26 16:38:49+00:00,"The true meaning of ""Black Friday"" has nothing to do with retail's bottom line.  https://t.co/jQsEpG1NYL",0,0,No,en,no media
1464269915737702400,2021-11-26 16:28:47+00:00,"For Black Friday only, snag a cordless vacuum, steam mop and vacuum robot on the low. https://t.co/w2bdToN6TW",0,0,No,en,no media
1464248211892224034,2021-11-26 15:02:32+00:00,U.S. health officials say Merck's experimental COVID-19 pill is effective but they raised questions about its safety during pregnancy. https://t.co/r63vGjRoqc,1,0,No,en,no media
1464232562264612869,2021-11-26 14:00:21+00:00,"""I was 8 years old the first time I took an opiate — an expired painkiller I found in our medicine cabinet with a 'May cause drowsiness' label."" https://t.co/HOAzJJ8AZA",1,1,No,en,no media
1464221327880036379,2021-11-26 13:15:43+00:00,"""Rediscovered the joy of reading for pleasure (bragging about it)."" https://t.co/9CDrnMAQEn",1,0,No,en,no media
1464217533364510728,2021-11-26 13:00:38+00:00,"""Parenting books should be legally required to display the number of children the author has."" https://t.co/ZHTeRedGwV",0,0,No,en,no media
1464188255239385091,2021-11-26 11:04:18+00:00,Too many exercise programs don't feel inclusive enough. Enter these A+ options. https://t.co/JgnEuUtKaa,1,2,No,en,no media
1464184468026052614,2021-11-26 10:49:15+00:00,"For today only, Casper's twin, twin XL, full, queen, king and California king Sleep Element mattresses are on sale. https://t.co/WZaRzfV8iJ",0,0,No,en,no media
1464176887475888135,2021-11-26 10:19:07+00:00,"Grab cookware favorites, like the heavy-duty Instant Precision Dutch oven or a Ninja smart pressure cooker, before the deals end. https://t.co/fqhSAnuCev",0,0,No,en,no media
1464117343060176929,2021-11-26 06:22:31+00:00,"Deals on headphones, laptops, furniture and more. https://t.co/pMak4DQ8Oo",0,0,No,en,no media
1464113553246466057,2021-11-26 06:07:27+00:00,"Save big on Apple Airpods Pro, KitchenAid stand mixers, smart devices, and more. https://t.co/XZA72v69Xd",0,0,No,en,no media
1464109767073439748,2021-11-26 05:52:24+00:00,"If you've had a Dyson cordless vacuum, AirPod Pros or Samsung frame TV on your wishlist, now's the perfect time to buy. https://t.co/TU3aCRjsAS",0,0,No,en,no media
1464105975879774218,2021-11-26 05:37:21+00:00,"A bunch of steals on things like AirPods Pro, Revlon's reviewer-beloved hot air brush and family-friendly Fire tablets. https://t.co/mzvzrv7ult",0,0,No,en,no media
1464094240561057795,2021-11-26 04:50:43+00:00,"He appealed to former Chief of Staff Mick Mulvaney to boot Fauci because Donald Trump was busy and ""I'm an economics guy,"" he told Steve Bannon. https://t.co/Ub3u3LbY7I",3,1,No,en,no media
1464079733893877764,2021-11-26 03:53:04+00:00,The United Kingdom temporarily barred flights from six African nations amid fears over the new coronavirus strain. https://t.co/KDMdPHkt8L,0,0,No,en,no media
1464061191509233666,2021-11-26 02:39:23+00:00,"A group representing African American firefighters said members were ""sickened and disgusted by this horrific display of unprofessionalism."" https://t.co/figfSVj9H3",1,0,No,en,no media
1463907684785217536,2021-11-25 16:29:24+00:00,"The decision follows the state's governor, Ron DeSantis, signing a bill that requires companies to allow workers to be exempt from vaccinations. https://t.co/LTOnPOUutJ",0,0,No,en,no media
1463870217029926918,2021-11-25 14:00:31+00:00,"""'Oh, so it isn’t all just in my head,' I thought. 'Everyone really is judging me because of my weight gain.'"" https://t.co/hfG4sRlXCp",0,0,No,en,no media
1463842841248120832,2021-11-25 12:11:44+00:00,"Today only, take up to 50% off espresso machines, waffle makers, blenders, slow cookers and more from Amazon. https://t.co/m2aOCQyNe6",0,0,No,en,no media
1463646296217112576,2021-11-24 23:10:44+00:00,"Get well-reviewed robotic vacs and mops from Roomba, Eufy, Bissell, Roborock and more on deep discount. https://t.co/kAYoMBXmep",0,0,No,en,no media
1463642498509811716,2021-11-24 22:55:39+00:00,Dyson’s cult favorite stick vacs are hugely coveted and on sale now -- up to $200 off -- for Black Friday. https://t.co/17Ut1iUD6x,1,0,No,en,no media
1463641866285498372,2021-11-24 22:53:08+00:00,"Get AirPods Pros for just $159, plus more sales on top wireless Bluetooth headphones and earbuds from Apple, Beats, Bose and JBL. https://t.co/4mr9WIGyaM",0,0,No,en,no media
1463633022423650304,2021-11-24 22:18:00+00:00,Glenn Youngkin's victory showed that parents can be a winning coalition for Republicans. Next up: the midterms. https://t.co/KfX6Vl83lR,0,0,No,en,no media
1463624804293087235,2021-11-24 21:45:20+00:00,"Officials say the most important lesson for businesses from the federal experience is that once they take the first step toward requirements, their workers will follow. https://t.co/mqQfrkRQBJ",2,0,No,en,no media
1463578320122302464,2021-11-24 18:40:38+00:00,"In a teary chat with Stephen Colbert, the actor said his ""Tick, Tick... Boom!"" performance reflects his ""unexpressed love"" for Lynn Garfield, who died in 2019. https://t.co/PMwIP1db71",2,0,No,en,no media
1463573513336500227,2021-11-24 18:21:32+00:00,"“It’s disgusting,” Matthew Judon told reporters. “Get it off the table. The bathrooms will be less busy and everybody will have a better day."" https://t.co/dt3iCgs5gM",0,0,No,en,no media
1463565172392476687,2021-11-24 17:48:23+00:00,"Want to take your sex life to the next level? From high-quality lube to essential oils, here's what experts recommend. https://t.co/0esi6y8up3",0,0,No,en,no media
1463560239563907077,2021-11-24 17:28:47+00:00,The streaming service announced the movies and shows arriving soon. https://t.co/gW1yMMh8UR,0,0,No,en,no media
1463555437832421388,2021-11-24 17:09:42+00:00,"Peter Buck, a nuclear physicist, invested $1,000 in a family friend’s Connecticut sandwich shop in 1965. https://t.co/hzTHpzTChi",0,1,No,en,no media
1463550884063985670,2021-11-24 16:51:36+00:00,The court overruled a voter-passed amendment to the state constitution that would have legalized recreational marijuana use. https://t.co/7QKueSxu7v,0,0,No,en,no media
1463539122400899075,2021-11-24 16:04:52+00:00,About a third of employers are estimated to run credit checks on potential hires. Here's what you need to know. https://t.co/hDFmocOBBy,0,0,No,en,no media
1463507823782993921,2021-11-24 14:00:30+00:00,"""After living through so much trauma and experiencing so much love, I finally understand that this holiday can mean what we want it to mean. We get to decide."" https://t.co/Nt66f7vHX6",0,0,No,en,no media
1463492678100865033,2021-11-24 13:00:19+00:00,Thanksgiving history taught in classrooms is often whitewashed. We asked Indigenous people what everyone should know about the holiday — and how non-natives can be better allies. https://t.co/Dv85gSpQ4u,1,0,No,en,no media
1463484859217850376,2021-11-24 12:29:15+00:00,Get in the holiday spirit with these festive looks. https://t.co/Zi5zhwszMk,1,0,No,en,no media
1463479933385199617,2021-11-24 12:09:40+00:00,"A federal jury says CVS, Walgreens and Walmart pharmacies didn’t do enough to stop the flow of opioid pills into two Ohio counties. https://t.co/j7HCT2VxBL",2,1,No,en,no media
1463466305751760896,2021-11-24 11:15:31+00:00,"No, you don't need to ""earn"" or ""burn"" your food. Here's why this mentality is more damaging than you realize. https://t.co/X3GFNmatlY",2,0,No,en,no media
1463462512561725443,2021-11-24 11:00:27+00:00,"Save on mattresses, toppers, pillows and more during Allswell's sitewide early Black Friday sale. https://t.co/QK4e578oeB",0,0,No,en,no media
1463458723515539456,2021-11-24 10:45:24+00:00,"Board games, adult card games and everything in between to add some fun to your next night in. https://t.co/nSyWlXu2Lw",0,0,No,en,no media
1463311604511084552,2021-11-24 01:00:48+00:00,"Sex ""would literally make me gag and sometimes even vomit,” the entertainer wrote in his new memoir. https://t.co/4yjfZK2xQo",0,0,No,en,no media
1463288357530836998,2021-11-23 23:28:25+00:00,"Actor Steve Burton, who first joined the soap in 1991, said it was ""about personal freedom to me."" https://t.co/SfpEYUu9bM",1,0,No,en,no media
1463284567113097222,2021-11-23 23:13:21+00:00,"We did the hard work for you. Shop Black Friday sales on everything from home décor, kitchen gadgets, beauty, fitness and more! https://t.co/FmEkNCHAqS",0,0,No,en,no media
1463260831941107717,2021-11-23 21:39:03+00:00,Nutrition experts share their advice for timing your air travel day eats. https://t.co/sRg47I6dtc,0,0,No,en,no media
1463246666891411456,2021-11-23 20:42:45+00:00,Experts break down how to put an end to the ceaseless back and forth. https://t.co/wqmTY9MtuK,0,1,No,en,no media
