id,created_at,text,favorite_count,retweet_count,is_retweet,language,media_type
1443233514242068486,2021-09-29 15:17:38+00:00,"From foot peels to heel creams, nail clippers, blister Band-Aids, foot files, pedicure products and more, these are among Amazon's top sellers. https://t.co/zdl5ZDneFV",0,0,No,en,no media
1443202849354272778,2021-09-29 13:15:47+00:00,"You may already know about the Starbucks apple crisp macchiato, but there are more out there worth trying. https://t.co/YxkgVWzmXl",2,0,No,en,no media
1443199059066437640,2021-09-29 13:00:43+00:00,"""With a woman and mother as vice president, I had hoped we would get a seat at the table. I just never expected that seat to be at my kitchen table."" https://t.co/Zk2JU68pKO",1,0,No,en,no media
1443169420688465925,2021-09-29 11:02:57+00:00,Pfizer and BioNTech plan to seek Food and Drug Administration emergency use authorization for their COVID-19 vaccine in kids ages 5 to 11. https://t.co/MJF5akA74E,2,1,No,en,no media
1443157434319708165,2021-09-29 10:15:19+00:00,Read this before you purchase a kit and test yourself for COVID-19. https://t.co/VBLF5mVkoS,0,2,No,en,no media
1443153646997413893,2021-09-29 10:00:16+00:00,"Getting dressed for the office again? Stylists, makeup artists and a productivity coach say how to get it done more efficiently. https://t.co/vUJJRtwdoF",0,0,No,en,no media
1443149984921227269,2021-09-29 09:45:43+00:00,Spanish heritage programs offer acceptance and belonging to those who want to reclaim their family language. https://t.co/HvJPxBANcn,0,0,No,en,no media
1442999574235279371,2021-09-28 23:48:02+00:00,"Palmer starred on the reality show's fifth season in 2004, though he didn't find love on the show. https://t.co/yHvLQ56Ffo",1,0,No,en,no media
1442981382217617412,2021-09-28 22:35:45+00:00,"The actor said she's ready to ""share myself with another [person],” but admits that “no one of importance has hit my radar yet.” https://t.co/5ySdKmQ5Gt",0,0,No,en,no media
1442956619889864706,2021-09-28 20:57:21+00:00,"Appearing on ""Ellen,"" the ""Black Swan"" star attempted to clarify her headline-making showering stance, but her latest comments may not fully help her cause. https://t.co/Zg4SytZ8S8",0,0,No,en,no media
1442940175839940609,2021-09-28 19:52:01+00:00,"Children form memories way earlier than we once thought. Here's why that matters, especially now. https://t.co/8Tb3FU2FxJ",0,0,No,en,no media
1442930553611702277,2021-09-28 19:13:46+00:00,"The two-time Grammy winner explained that Charcot-Marie-Tooth (CMT) disease has impacted his live performances, but won't affect his touring plans for now. https://t.co/ygP2x629cu",2,2,No,en,no media
1442917894711496707,2021-09-28 18:23:28+00:00,"The Duchess of Cambridge's Jenny Packham gown and its embellished cape turned heads at the ""No Time to Die"" premiere. https://t.co/2k5I22q2Uq",22,3,No,en,no media
1442889598586298372,2021-09-28 16:31:02+00:00,The new law also makes fashion brands more accountable for wage theft committed by subcontractors in L.A. garment factories. https://t.co/ORAe5ikUcD,2,1,No,en,no media
1442877841528352776,2021-09-28 15:44:19+00:00,The streaming service announced the movies and shows arriving soon. https://t.co/4nCLuZ8N8c,0,0,No,en,no media
1442873292935753728,2021-09-28 15:26:14+00:00,"""Today is school picture day so my kids wore their favorite toothpaste on their shirts."" https://t.co/tFciKvotoQ",1,0,No,en,no media
1442847519147446276,2021-09-28 13:43:50+00:00,Patient assaults on health care workers at a Branson hospital have tripled over the last year. https://t.co/3XxtUrRpJ3,0,0,No,en,no media
1442836656432746497,2021-09-28 13:00:40+00:00,"""Nothing prepared me for my daughter's call one afternoon. 'Ryan thinks Daddy’s dead!' she blurted when I answered."" https://t.co/JtTxgIZCr8",0,0,No,en,no media
1442795037469839362,2021-09-28 10:15:17+00:00,"Lipsticks, eyeshadow palettes and more gorgeous cosmetics made by and for Latinx creators https://t.co/fM6naCyo5Q",0,0,No,en,no media
1442791373971808259,2021-09-28 10:00:43+00:00,Want to make your vehicle as safe and useful as possible? Don't hit the road without these things. https://t.co/ugDeD1InTY,0,1,No,en,no media
1442787587337359362,2021-09-28 09:45:41+00:00,"A PSL itself isn't exactly healthy, but the real problem is what it makes your body crave after you drink it. https://t.co/hzC0xc8cFn",0,0,No,en,no media
1442616548930342924,2021-09-27 22:26:02+00:00,Take the conversation beyond Latinx Heritage Month and beyond the classroom. https://t.co/2A2WySiL7S,1,0,No,en,no media
1442601007712661508,2021-09-27 21:24:17+00:00,Can you get a Pfizer or Moderna booster if you initially got the other one? What about Johnson &amp; Johnson? Here's what we know now. https://t.co/2FWaD8vM8j,1,0,No,en,no media
1442578004992004098,2021-09-27 19:52:52+00:00,The Duke and Duchess of Sussex made their first joint public appearances together since welcoming their daughter in June. https://t.co/0bZFUXRYCm,0,0,No,en,no media
1442569519436730376,2021-09-27 19:19:09+00:00,Understood is an amazing “parent toolbox” for everything that has to do with learning and thinking differences in kids ages 3-20. https://t.co/uqUvbGppvu,1,0,No,en,no media
1442557395029434374,2021-09-27 18:30:59+00:00,People who had the coronavirus and then got the vaccine may be at an extreme advantage. Here's how. https://t.co/5MLqEllOsN,0,1,No,en,no media
1442537165330731011,2021-09-27 17:10:35+00:00,"A supernatural horror series and the new season of ""The Great British Baking Show"" are also trending. https://t.co/B3AoTpAejN",1,0,No,en,no media
1442528789443989511,2021-09-27 16:37:18+00:00,"A psychological thriller and a new ""My Little Pony"" film are also trending on the platform. https://t.co/YGoQEY23VK",2,0,No,en,no media
1442508953854820357,2021-09-27 15:18:29+00:00,"Get in the autumn spirit with fall home products, baking essentials, fire pits, cozy must-haves and seasonal scents. https://t.co/w7C4MHpwcs",0,0,No,en,no media
1442505147339268110,2021-09-27 15:03:22+00:00,She knows protection from COVID-19 is the best fall accessory. https://t.co/1Hx4ry0btC,1,1,No,en,no media
1442474213684678660,2021-09-27 13:00:27+00:00,"""I knew what to look for, but I missed the signs."" https://t.co/su03YQQnpI",0,0,No,en,no media
1442428920251371533,2021-09-27 10:00:28+00:00,"There’s no such thing as a facelift in a jar, but there's some over-the-counter skin care that can help. https://t.co/ehtfTwCCSL",0,0,No,en,no media
1442425129187909635,2021-09-27 09:45:24+00:00,"Areli Barrera Grodski started out with $75 and has grown her business exponentially, but the Latina shares her many challenges, from representation to racism. https://t.co/wMr9A1wcOX",0,0,No,en,no media
1442342082920787969,2021-09-27 04:15:24+00:00,"Who wouldn't want to ""glamp"" in a van with no shower or toilet? https://t.co/wFB7wX0OWS",0,0,No,en,no media
1442183145714028549,2021-09-26 17:43:51+00:00,"With over 40 million doses of vaccines available, health officisaid they’re confident there will be enough for every American who qualifies. https://t.co/bcsFLPDFvL",2,0,No,en,no media
1441969682790113280,2021-09-26 03:35:37+00:00,"Virologist Steven Hatfill was traveling to Arizona and Nevada to challenge Donald Trump election losses instead of fighting COVID, according to his emails. https://t.co/6DERjDhzXS",0,0,No,en,no media
1441903371342868480,2021-09-25 23:12:07+00:00,"Speaking of doctors, Trump added that he did ""pretty much the opposite"" of everything Fauci told him to do to fight COVID-19. https://t.co/ucQQuFIZxL",0,0,No,en,no media
1441749444534362115,2021-09-25 13:00:28+00:00,"""When the police camera footage first leaked from Gabby Petito’s missing person case, something inside of me recognized something inside of her."" https://t.co/1dDT6qGZuU",2,0,No,en,no media
1441549253172682754,2021-09-24 23:44:59+00:00,This is the first ferret to test positive for COVID-19 in the United States. https://t.co/zTz4SoIV2t,1,0,No,en,no media
1441545461781958656,2021-09-24 23:29:55+00:00,"The English actor, known for his ""Harry Potter"" film role, was taken to a hospital for treatment. A friend later reported he was OK. https://t.co/KDBwGL4NIa",0,2,No,en,no media
1441521985658425354,2021-09-24 21:56:38+00:00,"Kumang, a 44-year-old Bornean orangutan, died Thursday during recovery from anesthesia, according to a statement from the South Florida zoo. https://t.co/GIPFcSmvzi",1,0,No,en,no media
1441507322996695045,2021-09-24 20:58:22+00:00,The actor died of acute drug intoxication New York City’s medical examiner said on Friday https://t.co/dtQcSiqgDN,1,2,No,en,no media
1441460320019570689,2021-09-24 17:51:35+00:00,"""Rotisserie chicken wakes up the primal huntress in me."" https://t.co/t3cJxrxl66",0,0,No,en,no media
1441451419991695363,2021-09-24 17:16:14+00:00,"""Grandmas be like imma stay for a few days and reset your children back to factory settings."" https://t.co/1h3YKCdEqm",1,0,No,en,no media
1441442038285754368,2021-09-24 16:38:57+00:00,"“We are semi-separated but still love each other, see each other frequently and are on great terms,” the tech mogul told Page Six. https://t.co/CeAmFqeaF6",0,0,No,en,no media
1441431876279758850,2021-09-24 15:58:34+00:00,The CDC and FDA have weighed in on who is eligible for additional vaccine doses. Here's what the decisions mean for you. https://t.co/B7qh8fOh2A,0,0,No,en,no media
1441428079713345542,2021-09-24 15:43:29+00:00,"From cheap and easy (you need a new sealing ring!) to just plain brilliant (an air fryer lid!), you'll love these toys for your multicooker. https://t.co/ScKtDtSNmB",1,0,No,en,no media
1441413301334953986,2021-09-24 14:44:45+00:00,"The supermodel detailed her alleged income loss in a $50 million lawsuit after a ""fat-freezing"" process ""disfigured"" her, she said. https://t.co/XdqIW3QBbA",0,1,No,en,no media
1441389943041839113,2021-09-24 13:11:56+00:00,"""By refusing the vaccine and ignoring the science, a few of my siblings have denied our entire family an opportunity to properly say goodbye to him."" https://t.co/HBL1Qv2SuI",0,0,No,en,no media
1441386147960131585,2021-09-24 12:56:51+00:00,"From jewelry drawers to sweater stackers, here are space- (and sanity-) saving products your closet will thank you for. https://t.co/v8FZR4vqKe",0,0,No,en,no media
1441376165499969536,2021-09-24 12:17:11+00:00,"Have oodles of spooky fun with these clever animatronics, fog machines, props, lights and more. https://t.co/rjXWDjWqQ9",1,0,No,en,no media
1441371999809327114,2021-09-24 12:00:38+00:00,"""It’s got a lot of us, quietly behind the scenes, very worried about outbreaks of some of these other diseases,” said one pediatric infectious diseases specialist. https://t.co/nWw03oRUa7",0,0,No,en,no media
1441355840762654720,2021-09-24 10:56:26+00:00,The country star explained why he's only playing dive bars for the rest of the year at least. https://t.co/jSCgtV1nok,1,0,No,en,no media
1441352051410231296,2021-09-24 10:41:22+00:00,"Many lower-income nations are still waiting on their first vaccine doses, even as some countries like the U.S. prepare for booster programs for at-risk citizens. https://t.co/SNBkLnPBdu",0,0,No,en,no media
1441341829140533256,2021-09-24 10:00:45+00:00,"If you need a break from cooking, nutritionists suggest these companies — no subscription required. https://t.co/A5yYzFmsAI",1,0,No,en,no media
1441338038110416901,2021-09-24 09:45:41+00:00,These footwear options provide comfort and support without sacrificing style. https://t.co/FzFTM2kpF3,1,0,No,en,no media
1441290733336633344,2021-09-24 06:37:43+00:00,The Centers for Disease Control and Prevention has endorsed COVID-19 booster shots for millions of older or otherwise vulnerable Americans. https://t.co/4XgTvuLE4r,0,0,No,en,no media
1441171981580308481,2021-09-23 22:45:50+00:00,"""married sext: my headache is going away"" https://t.co/5ZDtsGoF1F",2,0,No,en,no media
1441166394708480004,2021-09-23 22:23:38+00:00,Here's what the latest news on the additional doses means for you.  https://t.co/JzP297pYUQ,0,0,No,en,no media
1441063219880206336,2021-09-23 15:33:39+00:00,Undead your spooky dessert game with everything from edible fake blood to skeleton cake pans to creepy cupcake sprinkles. https://t.co/Oc0eD3YKUs,0,0,No,en,no media
1441028503235928068,2021-09-23 13:15:42+00:00,"As temperatures continue to rise, so too are feelings of anxiety, depression and despair about our planet’s future. https://t.co/T5C90z98Bj",0,1,No,en,no media
1441024710523998209,2021-09-23 13:00:38+00:00,"""These men reduced me to an outdated, incorrect stereotype, as if I was only there to perform a specific task and fulfill a fantasy of theirs."" https://t.co/37zYNZlr9H",4,1,No,en,no media
1441003771245568000,2021-09-23 11:37:26+00:00,"The 1990s supermodel said she is now a recluse in the ""lowest depths of self-loathing."" https://t.co/2TxLMvFZPH",0,0,No,en,no media
1440983217968930816,2021-09-23 10:15:45+00:00,Here’s how to make sure the words of support and encouragement you choose don’t have the opposite effect. https://t.co/71MnKASp91,0,1,No,en,no media
1440979430135013376,2021-09-23 10:00:42+00:00,Uggs galore. Crazily low low-rise jeans. Anything went in the wild west of the early aughts. https://t.co/vmGHIOWwjc,4,1,No,en,no media
1440975647120232453,2021-09-23 09:45:40+00:00,"Imagine what it's like to rely on lip reading, and then everyone covers their face with a mask. Jamie Michelson shares her story. https://t.co/c8t4xsj1g7",4,1,No,en,no media
1440969969563537408,2021-09-23 09:23:07+00:00,The state's new surgeon general said it would be up to parents to decide if their kids could return to class. https://t.co/bzcNrk5bce,0,0,No,en,no media
1440966185064009728,2021-09-23 09:08:05+00:00,Kenneth Copeland served on Donald Trump's evangelical advisory panel in 2016. https://t.co/E8mjtU6FZ7,1,0,No,en,no media
1440822655947448323,2021-09-22 23:37:45+00:00,Pfizer said a third shot would restore the effectiveness of its COVID-19 vaccine to about 95%. https://t.co/5Xszh0YKZs,2,1,No,en,no media
1440818100157304836,2021-09-22 23:19:38+00:00,"Plus, the advice divorce attorneys give parents clashing over the coronavirus vaccine. https://t.co/DkCxyZgKWj",0,1,No,en,no media
1440745342991880198,2021-09-22 18:30:32+00:00,A new Amazon doc shows how LuLaRoe leadership tried to keep sellers loyal to the MLM. https://t.co/wRmLKgNbcd,0,0,No,en,no media
1440731547233964040,2021-09-22 17:35:43+00:00,Dr. Hasan Gokal said he didn't want any doses to go to waste. Harris County called it theft. https://t.co/G4AspSYnOd,1,0,No,en,no media
1440727749606330370,2021-09-22 17:20:37+00:00,"In Utah, where the church is based, a summer surge of the virus among unvaccinated residents has continued to grow while vaccination rates have slightly increased. https://t.co/4M534a14ME",0,1,No,en,no media
1440701584522899473,2021-09-22 15:36:39+00:00,"After the original, more traditional school bus fell through, teachers at the Brooke Charter School were forced to improvise. https://t.co/K3hSzdCwdR",2,0,No,en,no media
1440662306132676615,2021-09-22 13:00:34+00:00,"'When I look around at the middle-aged women I know ... I see something entirely different than what’s depicted in the media."" https://t.co/3BwLHrEVEA",2,0,No,en,no media
1440625725430636548,2021-09-22 10:35:13+00:00,The stepped-up U.S. commitment is to be the cornerstone of the global vaccination summit Biden is convening virtually Wednesday. https://t.co/66XwqTqXLF,1,1,No,en,no media
1440617017434775567,2021-09-22 10:00:36+00:00,"These skin care and beauty products do a whole lot more than slap on a ""clean"" label. https://t.co/yUIILlIosO",1,0,No,en,no media
1440613228715724800,2021-09-22 09:45:33+00:00,"Say goodbye to plastic baggies, everyone. https://t.co/7Djh9KxCce",4,0,No,en,no media
1440436706172231680,2021-09-21 22:04:07+00:00,Experts share their guidance for planning future travel at this stage of the pandemic. https://t.co/rx8iaFqnmK,0,0,No,en,no media
1440418008388694022,2021-09-21 20:49:49+00:00,"High community transmission, low vaccination rates and fewer efforts to curb infections have worsened the spread of the delta variant. https://t.co/Ugj7GWtfhK",1,1,No,en,no media
1440376214280048643,2021-09-21 18:03:45+00:00,"“Think of the vaccine as a large ethnic bouncer, and COVID as the drunk, entitled white kid yelling ‘Do you know who my father is?’” Peter Griffin's doctor suggests. https://t.co/GCNrPrd9du",3,0,No,en,no media
1440340890925486095,2021-09-21 15:43:23+00:00,The fast food giant is exploring using recycled plastic toys to make new restaurant trays. https://t.co/2OPOKa9XnA,0,0,No,en,no media
1440314844075331597,2021-09-21 13:59:53+00:00,The British prime minister not-so-subtly put the pressure on Jair Bolsonaro before the U.N. General Assembly. https://t.co/wM044cRK8R,3,1,No,en,no media
1440301089790693386,2021-09-21 13:05:13+00:00,"""Who has the right to access your body? To touch, probe, view images of your flesh? It is only flesh, after all. But it is also you."" https://t.co/R0zYwwRszB",0,1,No,en,no media
1440281787754692617,2021-09-21 11:48:31+00:00,"A booster dose of the Johnson &amp; Johnson vaccine produced an increased antibody response in adults from age 18 to 55, newly released data shows. https://t.co/XgI6dG7hiL",5,1,No,en,no media
1440273199246110720,2021-09-21 11:14:24+00:00,She kicked off her run in the dance competition after her parents served prison time in the college admissions scandal. https://t.co/Fkysk6ynlG,1,0,No,en,no media
1440258434050314245,2021-09-21 10:15:44+00:00,Feeling tired no matter how much rest you get? These behaviors you probably do every day could be to blame. https://t.co/ak0Ygm5ne6,3,1,No,en,no media
1440254645050347524,2021-09-21 10:00:40+00:00,"Skin, hair and makeup tips they’ve learned from their mamis, papis and their culture. https://t.co/g1FAv8ZUYQ",3,2,No,en,no media
1440250853869326358,2021-09-21 09:45:36+00:00,And is there a best time of day to feed it to them? Experts explain how to set your children up for success. https://t.co/OwIWXVgI0W,0,1,No,en,no media
1440231919388479492,2021-09-21 08:30:22+00:00,The unexpected second installment of the spoof awards ceremony was perhaps even grimmer than the first. https://t.co/k2ValJgrBO,1,0,No,en,no media
1440089109586980868,2021-09-20 23:02:53+00:00,"As a result of the text messages, Rep. Mari Manoogian was able to get a personal protection order from Rep. Steve Marino, who she previously dated. https://t.co/aFBv2x6jOv",0,0,No,en,no media
1440085315373318146,2021-09-20 22:47:49+00:00,"Taking abortion access away from female athletes will force many of them to ""sacrifice their athletic aspirations and pursuits,"" their letter reads. https://t.co/ZlRp9elcPd",2,2,No,en,no media
1440081519381409795,2021-09-20 22:32:44+00:00,Dr. Alan Braid was sued by a former lawyer in Arkansas who says Texas' extreme anti-abortion law should be subject to judicial review. https://t.co/HhzZGh3UTz,0,0,No,en,no media
1440064454012510210,2021-09-20 21:24:55+00:00,"In an article published this month, writer John Nolte says Democrats are using ""reverse psychology"" to trick opponents into dying of COVID-19. https://t.co/FVQ6QjcEeE",1,0,No,en,no media
1440056856160792579,2021-09-20 20:54:44+00:00,The pandemic still has the United States and other parts of the world firmly in its jaws. https://t.co/fJoOprzb8g,4,1,No,en,no media
1440048262560444421,2021-09-20 20:20:35+00:00,Here's what the vaccine rollout in kids ages 5-11 will look like — and what you can do to get ready right now. https://t.co/0n5vHJpJmA,0,0,No,en,no media
1440030426786004997,2021-09-20 19:09:42+00:00,"""Today's kids will never know how much strength you needed to get the car window down."" https://t.co/ZtfKiJIbfa",3,0,No,en,no media
1440026629061824512,2021-09-20 18:54:37+00:00,"“Are you serious?"" Graham laughs in a video she posted Monday. https://t.co/zr7051K2kn",3,1,No,en,no media
1440022840397422602,2021-09-20 18:39:34+00:00,A new Korean survival drama and adult animated series are also trending on the platform. https://t.co/JLI2renEWO,0,0,No,en,no media
1440000352254939136,2021-09-20 17:10:12+00:00,Lorena Vasquez was the only woman among 200 men at the rum brand. Here's how she earned her success. https://t.co/v6z909Hl6h,0,0,No,en,no media
1439996556040720389,2021-09-20 16:55:07+00:00,Dobbs v. Jackson Women’s Health Organization is a direct challenge to Roe v. Wade. https://t.co/NF3oY5bft2,0,0,No,en,no media
1439992761227350019,2021-09-20 16:40:02+00:00,"Whether you celebrate with kids or adults, these spooky tabletop and décor picks will do the trick. https://t.co/9tG4OTkcfU",0,0,No,en,no media
1439974947124809728,2021-09-20 15:29:15+00:00,Other popular films include an assassin's revenge flick and the story of a father's harrowing search for his missing son. https://t.co/8XvaeOonRH,1,0,No,en,no media
1439937477574340617,2021-09-20 13:00:22+00:00,"""A fellow survivor of suicide loss who’d attended Joe’s funeral said we had an increased risk of dying by suicide."" https://t.co/TsE8eh2svg",1,2,No,en,no media
1439915545797742596,2021-09-20 11:33:13+00:00,The drugmaker said it will seek U.S. authorization for this age group soon. https://t.co/4wrB8U8rIS,2,1,No,en,no media
1439888564649545728,2021-09-20 09:46:00+00:00,"Experts share what exercises to prioritize if you have lower back pain, upper back pain, a muscle spasm or sciatica issues. https://t.co/s9en4mNmuS",0,0,No,en,no media
1439796642341867520,2021-09-20 03:40:44+00:00,"The ""Neighbors"" actor said he was questioning his decision to take part in this year's ceremony due to COVID-19: ""They said this was outdoors. It’s not!"" https://t.co/ho8DVDhFap",3,0,No,en,no media
1439747798581358592,2021-09-20 00:26:39+00:00,"The ""Saturday Night Live"" star's shoes were designed by Syro, a queer-owned New York-based brand. https://t.co/KhS8gIFj1X",2,0,No,en,no media
1439716761939718146,2021-09-19 22:23:19+00:00,"TV's biggest stars from hit shows like ""The Crown, ""Ted Lasso,"" ""The Queen's Gambit"" and many more brought drama and class to the carpet. https://t.co/e4LsVYpjvJ",0,0,No,en,no media
1439634278057394182,2021-09-19 16:55:33+00:00,Anticipation for a vaccine for children ages 5 to 11 comes as pediatric coronavirus cases continue to spike across the country. https://t.co/2d91zxZByx,1,1,No,en,no media
1439560030416773126,2021-09-19 12:00:31+00:00,It would cost a lot of money. But there's a reason for that. https://t.co/MVAa6OAVuB,0,0,No,en,no media
1439375410224156678,2021-09-18 23:46:54+00:00,"“I fully understood there could be legal consequences,” Dr. Alan Braid wrote. But he said he wanted to make certain the ""blatantly unconstitutional law"" is tested. https://t.co/vLRpoNEU1C",4,1,No,en,no media
1439173875904958464,2021-09-18 10:26:05+00:00,"The U.S. territory's first case was of a resident who returned from Hawaii this week, said health officials. https://t.co/rZ8Bm5Q8HA",0,0,No,en,no media
1439070117573402627,2021-09-18 03:33:47+00:00,"Newsom, his wife Jennifer Siebel Newsom and their other two children had since tested negative for COVID-19, according to the Governor's office. https://t.co/sxQUIS0Zvq",1,1,No,en,no media
1438993551564677122,2021-09-17 22:29:32+00:00,"The 10-feet-wide home sold for $1.25 million, according to Zillow. https://t.co/kjVP4xSZpR",0,0,No,en,no media
1438954779577917442,2021-09-17 19:55:28+00:00,The 16-2 vote is a blow to the Biden administration's plans for giving booster shots to most Americans. https://t.co/AcwK8Sdkyw,0,0,No,en,no media
1438933434718691328,2021-09-17 18:30:39+00:00,"""LuLaRich"" is highlighting the problems with the MLM empire LuLaRoe. https://t.co/R6viuwidrc",0,0,No,en,no media
1438895551005741064,2021-09-17 16:00:07+00:00,"""Excuse me while I overthink this and get back to you."" https://t.co/hxDnnzfQ1J",1,0,No,en,no media
1438891761942900744,2021-09-17 15:45:04+00:00,"""Secret to peaceful parenting is to never tell your child the plans for the day."" https://t.co/6A8Jmn0WuD",3,1,No,en,no media
1438887972447862788,2021-09-17 15:30:00+00:00,"Drivers are growing tomatoes, cucumbers and string beans in the rooftop plots. https://t.co/L6RMuvGwwt",1,1,No,en,no media
1438872243254214656,2021-09-17 14:27:30+00:00,"What happens when you have two partners and you start to date someone new and their partner tells them they have to stop seeing you?

As @KeyanahNurse discovered, if you're open to exploring what happened and why, you can learn a lot about yourself

https://t.co/cFkTdNkH1u",0,13,Yes,en,no media
1438857561588051975,2021-09-17 13:29:10+00:00,"The Haiku Stairs have been a controversial tourist destination for decades, although they've been officially closed to trekkers since 1987. https://t.co/e1xwpPaW7N",2,0,No,en,no media
1438850373737930755,2021-09-17 13:00:36+00:00,"""I had been 'vetoed.'"" https://t.co/ZfW0MEzXbG",0,0,No,nl,no media
1438812656962506755,2021-09-17 10:30:43+00:00,COVID-19 isn't the only issue we're fighting. Exhaustion among medical professionals is more severe than ever. https://t.co/4vcJRGbvua,0,1,No,en,no media
1438808871863214084,2021-09-17 10:15:41+00:00,"Her neighborhood business will serve food made in-house daily by Asian elders, including her own mother. https://t.co/p8JTvT7y2q",2,1,No,en,no media
1438805084733853697,2021-09-17 10:00:38+00:00,No one enjoys explaining a gap on their resume. https://t.co/0bkrOYyjsH,1,0,No,en,no media
1438801297071878153,2021-09-17 09:45:35+00:00,These protective masks will pair well with your flannel and pumpkin spice lattes. https://t.co/Cgqc3ieScx,0,1,No,en,no media
