id,created_at,text,favorite_count,retweet_count,is_retweet,language,media_type
1420459545353146373,2021-07-28 19:02:01+00:00,The singer split from Brandon Blackstock in June 2020 after seven years of marriage. https://t.co/4ne1WKhqGO,2,1,No,en,no media
1420455750955118592,2021-07-28 18:46:56+00:00,"Apparently, fat-free mayo, which the company first introduced in the '90s, doesn't cut the mustard. https://t.co/6dIoUYcghj",0,0,No,en,no media
1420451962122870786,2021-07-28 18:31:53+00:00,The tech giant also pushed back its return-to-office date to mid-October. https://t.co/ytvckVeZ7a,2,1,No,en,no media
1420445897368948739,2021-07-28 18:07:47+00:00,Mosquito bites have you clawing at your skin? This expert advice will bring you relief in no time. https://t.co/x8SsUoiKHc,1,0,No,en,no media
1420442099518955520,2021-07-28 17:52:41+00:00,You love each other through it all... except when they ask you for the thousandth time to call their phone or clog the shower again with their hair. https://t.co/bVSaVtIRUx,0,0,No,en,no media
1420438054054121472,2021-07-28 17:36:37+00:00,Get proper rest and keep the peace in your relationship with these genius items. https://t.co/YKLHkDnDqS,0,1,No,en,no media
1420419115114803208,2021-07-28 16:21:21+00:00,"The products were shipped between June 20 and July 21 to 32 states, Bermuda and Canada. https://t.co/kctIsFX4bd",0,1,No,en,no media
1420382861396434944,2021-07-28 13:57:18+00:00,"As COVID-19 cases increase, the CDC has reversed guidance that allowed people who had been fully vaccinated to no longer wear face coverings. https://t.co/zYtnmxh5Lw",0,0,No,en,no media
1420368604156080136,2021-07-28 13:00:39+00:00,"""Every time tank top season arrives, I not only get a bit self-conscious, but also depressed."" https://t.co/zhEdDhBrFr",0,0,No,en,no media
1420340854208729091,2021-07-28 11:10:22+00:00,"Experts say Tokyo’s surge is being propelled by the new, more contagious delta variant of the coronavirus. https://t.co/3Um38Ra7QU",1,1,No,en,no media
1420330893667966981,2021-07-28 10:30:48+00:00,The Olympic champion knew her limits and set an example for us all. https://t.co/oOcREWEddY,11,0,No,en,no media
1420327109361287168,2021-07-28 10:15:45+00:00,"Pricey treatments claim to be the key to healthy hair, but experts share what really works and what doesn't. https://t.co/fpsixaLzKm",0,0,No,en,no media
1420323320088702977,2021-07-28 10:00:42+00:00,Experimenting (and messing up) is a crucial part of becoming a better home chef. https://t.co/f19BS7JuL9,0,0,No,en,no media
1420319534758735875,2021-07-28 09:45:40+00:00,"""It’s challenging, especially when we have the lights on us and all these expectations that are being thrown on top of us."" https://t.co/uPvmNaEWmh",1,0,No,en,no media
1420315747432243209,2021-07-28 09:30:37+00:00,Because your kitchen can be filled with products that have both beauty and brains. https://t.co/XWR9POZR9f,0,0,No,en,no media
1420153682814029830,2021-07-27 22:46:37+00:00,"“If you can see the dirt on them, clean them,"" Kutcher said. ""Otherwise, there's no point."" https://t.co/GWyg40tLXp",1,0,No,en,no media
1420132710161473537,2021-07-27 21:23:17+00:00,"""My husband woke up and started a new project and he could have just told me he wanted to fight."" https://t.co/hlvm8MshZX",3,1,No,en,no media
1420121215625306114,2021-07-27 20:37:37+00:00,"""The Twilight Saga"" continues to dominate, along with some other romantic fare. https://t.co/ums2fLnLuW",0,0,No,en,no media
1420117417645285377,2021-07-27 20:22:31+00:00,"A new season of ""The Walking Dead"" and ""Sex/Life"" are among the series in the ranking. https://t.co/qEPMiPpv5p",0,0,No,en,no media
1420113623746240518,2021-07-27 20:07:26+00:00,"The Netflix series, which debuts Aug. 4, finds the socialite trying her hand at a variety of dishes with the help of Kim Kardashian and other celebrity pals. https://t.co/0hhOBS2HER",1,0,No,en,no media
1420099590410342403,2021-07-27 19:11:41+00:00,Coronavirus cases are rising again across the country and vaccination rates are plateauing. https://t.co/6PAaznx9Sp,1,0,No,en,no media
1420095539190902787,2021-07-27 18:55:35+00:00,It's time to end this pervasive school of thought in sports and applaud athletes for prioritizing both. https://t.co/3zXJb6vUg6,4,1,No,en,no media
1420063956631277572,2021-07-27 16:50:05+00:00,"The federation’s president was unequivocal: “If you come back and you’re not vaccinated, everybody in that workplace is jeopardized.” https://t.co/rQtplESHrS",0,0,No,en,no media
1420041985344290818,2021-07-27 15:22:47+00:00,"The 24-year-old, who is widely recognized as the greatest gymnast of all time, also said she was ""not having as much fun"" at the Summer Olympics in Tokyo. https://t.co/WOUr7nUmy1",3,0,No,en,no media
1420006142416130049,2021-07-27 13:00:21+00:00,"One time, ""I  asked about the identity of someone in a group photo my roommate had posted on Facebook, only to find out the mysterious stranger was me."" https://t.co/E0Yqz90Fls",0,0,No,en,no media
1419981044791578628,2021-07-27 11:20:37+00:00,"The Huntington Beach eatery posted a sign protesting ""anti-American stupidity."" https://t.co/aRwe91I1Si",1,0,No,en,no media
1419967916838199304,2021-07-27 10:28:27+00:00,"""Seltzer is like if water took a Tony Robbins seminar."" https://t.co/O21eiNPU9u",1,0,No,en,no media
1419964129004199960,2021-07-27 10:13:24+00:00,No energy? No problem. These easy stretches and moves will have you feeling alert in no time. https://t.co/t9WtZxnpOX,1,0,No,en,no media
1419960337156218882,2021-07-27 09:58:20+00:00,"Take it from Andrea K. Castillo, a Brooklyn-based entrepreneur and model who's got the art down to a science. https://t.co/kTbUSqpN2C",8,2,No,en,no media
1419956545324990500,2021-07-27 09:43:16+00:00,Thousands of mostly maskless attendees attended the Phoenix rally featuring the former president. https://t.co/JMufrtPkN2,0,0,No,en,no media
1419794651167531017,2021-07-26 22:59:58+00:00,Don’t assume your apology will work right away. Just look at Chrissy Teigen. https://t.co/haglGQx8rH,0,0,No,en,no media
1419784920650690566,2021-07-26 22:21:18+00:00,"At the request of the FDA, the vaccine makers are expanding their trials with young children, seeking to better detect very rare heart issues. https://t.co/dTe4bMrvu9",1,0,No,en,no media
1419780623183589379,2021-07-26 22:04:13+00:00,"The Oscar winner will star alongside Leslie Odom Jr. in a three-film ""continuation"" of 1973's head-spinning classic. The first movie is due out in 2023. https://t.co/BZShHCcOX5",0,0,No,en,no media
1419776828584124421,2021-07-26 21:49:08+00:00,"Rayssa Leal, who earned internet gold in 2015 when filmed shredding in fairy wings and a dress at 7, is now one of the youngest athletes to earn an Olympic medal. https://t.co/VV6pRClr1W",6,2,No,en,no media
1419768873306529794,2021-07-26 21:17:32+00:00,"""It’s truly revolting to hear a privileged ignoramus like yourself pretend to be a victim of segregation,"" one Twitter critic wrote, addressing the far-right lawmaker. https://t.co/183miSxFvw",1,0,No,en,no media
1419763437274533892,2021-07-26 20:55:56+00:00,"It turns out that odor-removing gel, rainbow tile film and bed sheet holders make very noticeable improvements. https://t.co/xxYjpk3CbW",1,1,No,en,no media
1419755610015416323,2021-07-26 20:24:49+00:00,"The new order, which also mandates weekly testing for anyone who doesn't get vaccinated, affects upward of 2.25 million people in the state. https://t.co/Td5QpOJmGz",4,4,No,en,no media
1419734145480151048,2021-07-26 18:59:32+00:00,"Four months after lifting bans on evictions, states saw twice as many COVID-19 cases and five times more deaths, UCLA researchers found. https://t.co/O3li2N0SVk",0,0,No,en,no media
1419730353565192196,2021-07-26 18:44:28+00:00,Diane and Ed Nesselhuf bought the can during a 1971 honeymoon in Denver and vowed to drink it on their golden anniversary. https://t.co/h7oReWWGjD,1,0,No,en,no media
1419724544680603652,2021-07-26 18:21:23+00:00,"The 7-day rolling average on Sunday was about 583,000 vaccinations a day, up from about 525,000 a week prior. https://t.co/9CIXYH2tQL",2,1,No,en,no media
1419713548809342987,2021-07-26 17:37:41+00:00,"""The ADA is more than a law,"" Biden said. ""It’s a testament to our character as a people, our character as Americans.” https://t.co/t09itGYAky",1,1,No,en,no media
1419695364228239361,2021-07-26 16:25:26+00:00,"The largest city on Georgia’s coast has seen an ""alarming rise"" in cases. The delta variant, low vaccination rates and large gatherings are believed responsible. https://t.co/vb8Zxvhwyl",1,0,No,en,no media
1419689175952105472,2021-07-26 16:00:50+00:00,Seriously -- why splurge on decor when you can save? https://t.co/qUXLiBLqw1,2,1,No,en,no media
1419680587326046212,2021-07-26 15:26:43+00:00,Monday’s announcement follows a similar mandate for employees at city-run hospitals and health clinics. https://t.co/0ANqeDFIKe,0,0,No,en,no media
1419676790914703362,2021-07-26 15:11:37+00:00,“Vaccination is the primary way to put the pandemic behind us and avoid the return of stringent public health measures.” https://t.co/ai0lKG2xv3,3,2,No,en,no media
1419648278170308609,2021-07-26 13:18:19+00:00,Steal these self-care methods that mental health pros use when they're drained or unmotivated. https://t.co/GnfNsHi2kU,0,0,No,en,no media
1419643860368699396,2021-07-26 13:00:46+00:00,"“I’m not willing to risk my sobriety, because I don’t know what might awaken that monster that kept me from my kids.” https://t.co/n4M5SzBxoK",2,0,No,en,no media
1419598468566429705,2021-07-26 10:00:24+00:00,"Not all fashion bosses are like Miranda Priestly in ""The Devil Wears Prada,"" but some are close. Four industry professionals share their reality. https://t.co/zeo7Al1dmO",0,0,No,en,no media
1419594803810086913,2021-07-26 09:45:50+00:00,The executive chef opened up about how setbacks led to the long-lasting success of her catering company. https://t.co/IxWvrYxWVP,0,0,No,en,no media
1419384483334266880,2021-07-25 19:50:06+00:00,"While it's rare for humans to contract the disease, health officials warn that it can turn serious if not immediately treated. https://t.co/jf8DtKtpqB",1,1,No,en,no media
1418922847351853058,2021-07-24 13:15:43+00:00,Workers fear the more contagious delta variant just as safety policies are being eased. https://t.co/nDuQ4J9pMr,0,1,No,en,no media
1418919063745667078,2021-07-24 13:00:41+00:00,"""I want my largest asset to serve a wider purpose beyond familial enrichment."" https://t.co/V5DdO9zZeJ",1,0,No,en,no media
1418873771092582400,2021-07-24 10:00:43+00:00,"It's Rapid Potato Cooker Summer, y'all. https://t.co/XQ9dHoJFK1",1,0,No,en,no media
1418869979122970632,2021-07-24 09:45:39+00:00,"""He said if I take the vaccine I could pack my bags and leave his kids here."" https://t.co/t8WZ7cgfze",1,0,No,en,no media
1418628800406069252,2021-07-23 17:47:17+00:00,"Smart finds many readers and reviewers just like you have bought, so why haven't you? https://t.co/PmWvvxCr84",1,0,No,en,no media
1418625011204739073,2021-07-23 17:32:14+00:00,"If you felt like we were safe, news about the delta and lambda variants and rising coronavirus cases can be unnerving. Here's how to deal. https://t.co/zWr8zvazFh",1,3,No,en,no media
1418584332151803908,2021-07-23 14:50:35+00:00,"""'This could’ve been an email' -- me at my daughter’s recital."" https://t.co/X8Y3eXsuzs",4,2,No,en,no media
1418580539863359489,2021-07-23 14:35:31+00:00,"Twitter users didn't miss the boat in mocking the Team USA preppy ""yacht"" vibe. https://t.co/7E1ARj1Ku6",2,1,No,en,no media
1418565130028298240,2021-07-23 13:34:17+00:00,"A miracle-working lawn repair formula, power washer, leaf blower and other things to improve your yard. https://t.co/Hkj8MwApuD",1,0,No,en,no media
1418560080916754440,2021-07-23 13:14:13+00:00,"""The 'ski mask rapist' terrorized at least 25 women. The deputy DA called him 'arguably the most vicious and horrific serial rapist' in the county’s history."" https://t.co/zk0tK3Tygg",0,0,No,en,no media
1418556283498737664,2021-07-23 12:59:08+00:00,"After the Larry Nassar scandal, advocates are calling on sports groups, gyms and more to commit to preventing child sexual abuse by adopting the set of principles. https://t.co/iJ9UvcNKVh",2,2,No,en,no media
1418518937596276741,2021-07-23 10:30:44+00:00,"Around 15% of residents of the Olympic Village are unvaccinated against COVID-19, according to the International Olympic Committee. https://t.co/SOOKr2J3LS",0,0,No,en,no media
1418515145366638593,2021-07-23 10:15:40+00:00,"The past year has turned us all into at-home imbibing experts, but these books prove we still have much to learn. https://t.co/4s8KCLIfFk",1,1,No,en,no media
1418511353761959942,2021-07-23 10:00:36+00:00,This common phrase doesn't actually give any insight into a company's salary levels — and it just might be a red flag. https://t.co/BmKjWyi5x2,0,0,No,en,no media
1418507562706743297,2021-07-23 09:45:32+00:00,"This ""Wizard of Oz"" print is all the rage. https://t.co/OIg1YwrdA8",0,0,No,en,no media
1418496958260469764,2021-07-23 09:03:23+00:00,"""Don’t shove it down my throat,"" Scott Roe told CBS News from his hospital bed. https://t.co/Tzb5cKyVni",0,0,No,en,no media
1418486737345601539,2021-07-23 08:22:47+00:00,Gov. Kay Ivey also called out right-wing media disinformation about the vaccine. https://t.co/4pSJjxkEsx,1,0,No,en,no media
1418435914024509440,2021-07-23 05:00:49+00:00,"""Don’t be deceived that ‘I got this far and I am OK.’ This is a very different variant. It will find you,"" said Dr. Gregory Poland in a dire message. https://t.co/dxLMqOkdkh",4,0,No,en,no media
1418420899804504064,2021-07-23 04:01:10+00:00,"Greene has continued to rail against vaccinations, which threatens public health. https://t.co/wf8rJSVLzs",0,0,No,en,no media
1418348106110881792,2021-07-22 23:11:54+00:00,Experts share how anxiety may manifest in children in this time of transition. https://t.co/RmcTc4yc8y,0,0,No,en,no media
1418339901842497536,2021-07-22 22:39:18+00:00,The office of Mississippi’s Republican attorney general said states should decide whether to regulate abortion before a fetus can survive outside the womb. https://t.co/3hRJM7UtJO,0,0,No,en,no media
1418325434362515456,2021-07-22 21:41:49+00:00,Got a funny or annoying story about sharing desks at work? We want to hear about it. Email monica.torres@huffpost.com with your story. https://t.co/Jp72onD7K3,4,4,No,en,photo
1418321580149596165,2021-07-22 21:26:30+00:00,The league is taking a major step to incentivize players to get vaccinated as coronavirus cases rise nationwide. https://t.co/7IoA3eB1AP,0,0,No,en,no media
1418274356980076548,2021-07-22 18:18:51+00:00,"Dr. Ronny Jackson, now a GOP Texas congressman, asked reporters why they weren't demanding Democratic politicians reveal their vaccination status. https://t.co/3VFXuAVbN8",0,0,No,en,no media
1418263743608336386,2021-07-22 17:36:41+00:00,"The suspect bought the plane ticket with his wife’s name and brought the identity card, the PCR test result and the vaccination card with his wife’s name. https://t.co/mZTBEsj8HQ",1,0,No,en,no media
1418251112231096325,2021-07-22 16:46:29+00:00,“A bird flew on my face! A bird flew on my face! Oh my God!” https://t.co/bQVKieOl6P,1,0,No,en,no media
1418244918703755265,2021-07-22 16:21:52+00:00,Making Marie Kondo proud. https://t.co/wU6ThcywRh,1,0,No,tl,no media
1418194288748470279,2021-07-22 13:00:41+00:00,"""The global pandemic has exposed the already crumbling foundation of the American food system."" https://t.co/VWzjysvkrE",0,1,No,en,no media
1418181039021871106,2021-07-22 12:08:02+00:00,Osaka’s first match in nearly two months will come against 52nd-ranked Zheng Saisai of China in the opening round of the Olympic tennis tournament. https://t.co/ZJ3FgADpYG,2,0,No,en,no media
1418167923328311301,2021-07-22 11:15:55+00:00,Breakthrough coronavirus cases are disappointing ― but most of them are also evidence that the shots are working. https://t.co/uSaDzxzlI9,3,3,No,en,no media
1418164139126628357,2021-07-22 11:00:53+00:00,"It would be a big spending item in the budget, but that's because it could have a big effect on working parents and their children. https://t.co/JayblnhUWh",1,1,No,en,no media
1418160348448894978,2021-07-22 10:45:49+00:00,The actor and singer has been gracing the red carpet for nearly 15 years. https://t.co/9NPfJ7kqp5,2,0,No,en,no media
1418156560384155651,2021-07-22 10:30:46+00:00,These are the most adorable moments of Prince William and Kate Middleton's royal son. https://t.co/sIIIyJQOXj,1,0,No,en,no media
1418152771677822977,2021-07-22 10:15:43+00:00,These items will help you both mix up your routine and something delicious. https://t.co/bwB8mX6Hh6,1,0,No,en,no media
1418148982371635201,2021-07-22 10:00:39+00:00,"From beans to Beyond Meat, have you ever wondered which alternative to meat is best for the planet? (Hint: They're all better than meat.) https://t.co/1thpPCyV3B",1,0,No,en,no media
1418145189948973058,2021-07-22 09:45:35+00:00,"More than a dozen doctors with disabilities say discrimination, lack of support and “grind culture” make it nearly impossible to thrive in their chosen careers. https://t.co/LJtguNPAnX",5,1,No,en,no media
1418072672953569281,2021-07-22 04:57:26+00:00,"""We have a pandemic for those who haven't gotten the vaccination,” the president said during a CNN town hall. https://t.co/qyvJrdo8Ms",4,1,No,en,no media
1418023986907254787,2021-07-22 01:43:58+00:00,"""They thought it was a hoax,"" said Dr. Brytney Cobia of Alabama as she implored people to get vaccinated while they can still protect themselves. https://t.co/4fsFfKfDwA",4,4,No,en,no media
1417992303722078219,2021-07-21 23:38:04+00:00,The city is the latest to issue new protective measures against COVID-19 as the delta variant spreads dramatically among unvaccinated people. https://t.co/M4ZiXMeNIo,1,2,No,en,no media
1417967793115484161,2021-07-21 22:00:41+00:00,One of Dorothy Gale’s iconic farm-girl frocks was rumored to be somewhere in the Catholic University of America’s drama department. https://t.co/b3DCG9yDDx,0,0,No,en,no media
1417964002014072843,2021-07-21 21:45:37+00:00,The Bronx rapper publicly revealed she was expecting her second child with husband Offset during a performance at the 2021 BET Awards in June. https://t.co/MG46tCSRqa,0,0,No,en,no media
1417960208291311621,2021-07-21 21:30:32+00:00,Kensington Palace released birthday portraits of the third in line to the throne one day before his big celebration. https://t.co/ta6AMZ4nWb,1,0,No,en,no media
1417956034640031749,2021-07-21 21:13:57+00:00,Don't be fooled by that viral clip of Sean Hannity; Fox News hosts are casting doubt on the COVID-19 vaccine just as much as they always have. https://t.co/yljckIcN5J,2,1,No,en,no media
1417944550937710595,2021-07-21 20:28:19+00:00,COVID-19 cases have tripled in the U.S. over two weeks amid an onslaught of vaccine misinformation. https://t.co/Tj1blp5OxK,1,3,No,en,no media
1417940756371812354,2021-07-21 20:13:15+00:00,The Milwaukee Bucks superstar took both the team’s NBA championship trophy and his own MVP trophy to a Chick-fil-A drive-thru on Wednesday. https://t.co/KzDbX9K6su,0,0,No,en,no media
1417919400594886662,2021-07-21 18:48:23+00:00,The Cleveland Browns quarterback spoke openly about how important it is to get your COVID-19 shot. https://t.co/oONv49ZGxM,7,3,No,en,no media
1417914850387316762,2021-07-21 18:30:18+00:00,"Experts share common missteps people make when ""traveling"" in their own hometowns. https://t.co/pWlDBWyAMG",0,0,No,en,no media
1417911056618426373,2021-07-21 18:15:14+00:00,Spain’s synchronized swimming team captain spoke out against rules that have made it impossible for her to take her baby to the Tokyo Games. https://t.co/to3sEmkkQp,0,0,No,en,no media
1417907261922545666,2021-07-21 18:00:09+00:00,"“To pull this care midstream from these patients, or minors, would cause irreparable harm,” .S. District Judge Jay Moody ruled on Wednesday. https://t.co/iKWOPyrSaT",0,0,No,en,no media
1417882385102815235,2021-07-21 16:21:18+00:00,Nonessential travel from Canada and Mexico will be banned for another 30 days. https://t.co/HiA5DgBDGp,4,3,No,en,no media
1417831890577498113,2021-07-21 13:00:39+00:00,"""I couldn’t imagine watching a man assault a woman in the middle of the day in front of everyone and doing nothing."" https://t.co/klm5uiQo58",1,0,No,en,no media
1417808932815491084,2021-07-21 11:29:25+00:00,The CDC said the decline was even starker among Hispanic and Black Americans. https://t.co/ad9zmPKfR3,1,1,No,en,no media
1417805148370386946,2021-07-21 11:14:23+00:00,"Expect upscale basics, easy-to-style solids and sophisticated patterns to get you through your schedule. https://t.co/kxBMEOxFQD",0,0,No,en,no media
1417801359374667778,2021-07-21 10:59:20+00:00,"Stop pushing buttons and start turning the crank. Your tastebuds, the planet and your friends will thank you. https://t.co/NmNuAuKMPQ",4,2,No,en,no media
1417797568277401602,2021-07-21 10:44:16+00:00,Because we've all been there. https://t.co/V2IGFoIXCR,1,0,No,en,no media
1417793779717840896,2021-07-21 10:29:13+00:00,Affordable and credible pieces always have a place in everyone's heart and closet. https://t.co/CHxZevFdNI,0,0,No,en,no media
1417789984774443018,2021-07-21 10:14:08+00:00,Read this if you plan on spending any time outdoors. Your body will thank you. https://t.co/DPct5xsSjN,0,0,No,en,no media
1417786196202250244,2021-07-21 09:59:05+00:00,Olympic sprinter Florence Griffith Joyner's style was worthy of a champion. https://t.co/nl1hswHqkA,5,0,No,en,no media
1417782409504886784,2021-07-21 09:44:02+00:00,He remained at large for eight hours following the dangerous escape. https://t.co/diJPzbgHah,0,1,No,en,no media
1417664107587817473,2021-07-21 01:53:56+00:00,"The No. 2 House Republican held off on getting vaccinated for months, telling https://t.co/JOVLVQN5FQ that the fast-spreading delta variant tipped the scale. https://t.co/12ypr3ro3V",0,0,No,en,no media
1417641763553021955,2021-07-21 00:25:09+00:00,"After the far-right lawmaker said COVID-19 only threatened seniors and the obese, she burst into laughter when a reporter pointed out deaths in other populations. https://t.co/9AaTNyNHcz",1,1,No,en,no media
1417629261188456451,2021-07-20 23:35:28+00:00,The ban allows the procedure to save the life of the mother in a medical emergency and does not provide exceptions for those impregnated in an act of rape or incest. https://t.co/YTMR6LK59a,0,2,No,en,no media
1417625467893522435,2021-07-20 23:20:24+00:00,"The country icon wanted to make Carl Thomas Dean blush by posing in bunny ears and a bustier. ""He still thinks I’m a hot chick after 57 years,"" she quipped. https://t.co/V1v4reAeoD",3,1,No,en,no media
1417597048153509890,2021-07-20 21:27:28+00:00,"Deaths from the virus are also rising, with an average of 239 per day over the last week. That's a near-48% rise from the week prior, said Dr. Rochelle Walensky. https://t.co/W5DzgtoGSZ",3,2,No,en,no media
1417557885870034944,2021-07-20 18:51:51+00:00,"The platform's automated systems keep insisting the word ""hoe"" violates community standards. https://t.co/DE1HcqStYg",1,0,No,en,no media
1417552959840399362,2021-07-20 18:32:17+00:00,"“You edit together these images to look like I’m happily waving, but that is deceitful,” the “Gossip Girl” alum commented on the since-deleted post. https://t.co/ouWVpcemA4",3,1,No,en,no media
1417549162166562819,2021-07-20 18:17:11+00:00,The app is removing its global transaction feed amid privacy concerns. https://t.co/qyXmr6VZJE,1,0,No,en,no media
1417529070045339652,2021-07-20 16:57:21+00:00,"""STOP YELLING screamed the parent."" https://t.co/UkvRRf3HAi",0,0,No,en,no media
1417503453199360003,2021-07-20 15:15:33+00:00,"The ""Dawson's Creek"" alum said the proposal took place during an ""incredibly romantic"" beach walk in Nicaragua. https://t.co/xVCORuyWOu",0,0,No,en,no media
1417499650530103304,2021-07-20 15:00:27+00:00,"“Different families will deal with a pregnancy loss in their own ways, but they deserve the opportunity to deal with it,” said Sen. Tammy Duckworth, a co-lead on the Support Through Loss Act. https://t.co/d2S0kyYa8X",1,1,No,en,no media
1417491948244545542,2021-07-20 14:29:50+00:00,"Get ready to dive into the fashion deep end — c'mon in, the water's fine. https://t.co/CQNmul9uVa",1,0,No,en,no media
1417469485976535052,2021-07-20 13:00:35+00:00,"""We fill our social media feeds with happy baby photos yet we crumple behind closed doors."" https://t.co/vqa02SW9C0",0,0,No,en,no media
1417435550135603244,2021-07-20 10:45:44+00:00,Job applications from people of underrepresented backgrounds increased by 118% with this one big decision. https://t.co/QfkKY39L9n,0,0,No,en,no media
1417431760103788555,2021-07-20 10:30:40+00:00,"At-home products have been growing in popularity, but will they damage your hair? We asked the experts. https://t.co/VPgEFwTEvf",0,0,No,en,no media
1417427970592067619,2021-07-20 10:15:37+00:00,Feeling more drained than usual lately? It's not just you. Here's what's going on and what to do about it. https://t.co/LQYJb8b5Km,4,1,No,en,no media
1417424308088066063,2021-07-20 10:01:04+00:00,You may be making these common marinade mistakes. Experts advise on how to avoid them. https://t.co/ePfYnMwmy1,1,0,No,en,no media
1417420517146075136,2021-07-20 09:46:00+00:00,Here's the state-by-state breakdown from the Social Security Administration. https://t.co/6L0X2xADrn,0,0,No,en,no media
1417395790637584384,2021-07-20 08:07:45+00:00,The new Hall of Presidents will also feature one of Biden's signature accessories. https://t.co/w6GYwxTiXK,0,0,No,en,no media
