id,created_at,text,favorite_count,retweet_count,is_retweet,language,media_type
1462452479451299844,2021-11-21 16:06:56+00:00,#Chargers: “You ever take a drink of water and swallow it wrong and all of a sudden you’re coughing? How many reps do you have taking a drink of water? You can still mess it up.” https://t.co/ZpjIdLF8Ir,0,3,Yes,en,no media
1462451995709739012,2021-11-21 16:05:01+00:00,Chip Kelly on a cooling hot seat? Takeaways from UCLA's victory https://t.co/1ohD8uRvra,0,0,No,en,no media
1462440565841162245,2021-11-21 15:19:36+00:00,Orange County Soccer Club scores a long-desired goal by reaching USL final ⁦@orangecountysc⁩  https://t.co/gGZoO0zoxw,0,7,Yes,en,no media
1462440516730056708,2021-11-21 15:19:24+00:00,Ambitious plans of former Steeler Rob Golden come to fruition. #SteelerNation @Steelersdepot https://t.co/2GoKvllXps,0,8,Yes,en,no media
1462440212164870150,2021-11-21 15:18:12+00:00,"🧵Dig into our UCLA-USC team coverage: 

@BillPlaschke writes the joy of blowing out rival USC is tempered for UCLA fans because it likely means Chip Kelly will stay.

Will UCLA soon suffer a lost season just like USC after keeping its coach too long?

https://t.co/94XyazgaL5 https://t.co/Gm4lsK3MsR",0,8,Yes,en,no media
1462421793440944133,2021-11-21 14:05:00+00:00,"Chargers vs. Pittsburgh Steelers matchups, start time and how to watch https://t.co/yW36upEZzx",4,3,No,en,no media
1462391596272570374,2021-11-21 12:05:01+00:00,'Bigger than sports': Former Steelers safety Robert Golden starts school in Fresno https://t.co/n2C3m7NoLC,3,1,No,en,no media
1462331199867736066,2021-11-21 08:05:01+00:00,Orange County Soccer Club scores a long-awaited goal by reaching USL final https://t.co/8hjnbizl2Y,2,0,No,en,no media
1462316682089664514,2021-11-21 07:07:20+00:00,Orange County Soccer Club scores a long-awaited goal by reaching USL final https://t.co/8hjnbihJEo,1,0,No,en,no media
1462306491042463745,2021-11-21 06:26:50+00:00,"USC’s defense fell apart, and UCLA’s Dorian Thompson-Robinson followed through on his promise to beat “the everliving s—“ out of the Trojans (from @latbbolch) https://t.co/zAXKKD3QMs",0,11,Yes,en,no media
1462300748956459012,2021-11-21 06:04:01+00:00,Terence Crawford defeats Shawn Porter in 10th round to keep welterweight title https://t.co/L2RGXASU7O,4,1,No,en,no media
1462295965960921092,2021-11-21 05:45:01+00:00,Marymount wins state Open Division girls' volleyball title to cap undefeated season https://t.co/ZQr4GBxOLh,2,0,No,en,no media
1462290935027585028,2021-11-21 05:25:01+00:00,Jaxson Dart makes mistakes — and offers a glimmer of hope — in first USC start https://t.co/K3olpjBRdW,0,0,No,en,no media
1462289969561571331,2021-11-21 05:21:11+00:00,Marymount wins state Open Division girls’ volleyball title to cap undefeated season https://t.co/ZQr4GBPpCP,8,3,No,en,no media
1462286485957197825,2021-11-21 05:07:20+00:00,Jaxson Dart makes mistakes — and offers a glimmer of hope — in first USC start https://t.co/K3olpjTs5u,5,1,No,en,no media
1462277505469927431,2021-11-21 04:31:39+00:00,Photos: UCLA’s Dorian Thompson-Robinson dominates in rout over USC https://t.co/DwEipHsI9p,17,3,No,en,no media
1462275835407261697,2021-11-21 04:25:01+00:00,Dorian Thompson-Robinson enthralls with acrobatic talent in UCLA's blowout over USC https://t.co/BbrDB7S7Cg,5,2,No,en,no media
1462275165262270468,2021-11-21 04:22:21+00:00,Marymount is a state champion. https://t.co/fMZ7lqQGA4,0,3,Yes,en,video
1462273700577742855,2021-11-21 04:16:32+00:00,Dorian Thompson-Robinson enthralls with acrobatic talent in UCLA’s blowout win over USC https://t.co/BbrDB7AwdG,5,0,No,en,no media
1462265767068590082,2021-11-21 03:45:01+00:00,Plaschke: Chip Kelly shouldn't get to keep his job because UCLA beat a terrible USC team https://t.co/JX1aHfBR7h,36,3,No,en,no media
1462255451286945792,2021-11-21 03:04:01+00:00,High school boys’ water polo: Southern California Regional championship results https://t.co/9b31S7ovNX,0,1,No,en,no media
1462233759764258818,2021-11-21 01:37:49+00:00,A message from @Noahsyndergaard ⚡️ https://t.co/OkBSXnkvcb,0,626,Yes,en,photo
1462231896016912390,2021-11-21 01:30:25+00:00,"Title Defended 🏆🛡

@Sagehens wins its second consecutive @NCAADIII Men's XC National Championship!
#GoSagehens https://t.co/XZuEk0ozJK",0,8,Yes,en,no media
1462221455236612098,2021-11-21 00:48:56+00:00,Dorian Thompson-Robinson reunites with the fan who gave him a hat to sign during the game to take a selfie. https://t.co/S5Jhp3GlFR,0,53,Yes,en,no media
1462221413813669890,2021-11-21 00:48:46+00:00,"Time to panic? 

LeBron James says Lakers need to play with ‘some sense of urgency anytime we take the floor' https://t.co/4V1MxI2jqC",0,0,No,en,no media
1462221026587123715,2021-11-21 00:47:14+00:00,"FINAL: UCLA crushes USC 62-33 after a standout performance from Dorian Thompson-Robinson, who scored six touchdowns. How are you feeling, friends? Tell me in a GIF https://t.co/maSeL73c3h",0,45,Yes,en,no media
1462220270249205764,2021-11-21 00:44:13+00:00,#UCLA sets a new mark for the most points it has ever scored against rival #USC in a 62-33 victory at the Coliseum https://t.co/mmHZUQeaOD,41,12,No,en,no media
1462216946796089346,2021-11-21 00:31:01+00:00,LeBron James says Lakers need to play with 'urgency' https://t.co/4V1MxHKIz4,0,1,No,en,no media
1462216726272102400,2021-11-21 00:30:08+00:00,Dorian Thompson-Robinson made sure UCLA scored the most points (55) ever against USC by winning the high hurdle on the way to the end zone. https://t.co/55u59Cn54M,0,10,Yes,en,no media
1462215890133340168,2021-11-21 00:26:49+00:00,"He's a runner, he's a track star. 

@DorianTweets HURDLES over a Trojan defender for his second running TD of the game! 

UCLA 55, USC 33
3:47 - 4th Quarter

📺: FOX
📲: https://t.co/0huWohEm37
#GoBruins https://t.co/IEYXOTdShk",0,431,Yes,en,no media
1462215543574777861,2021-11-21 00:25:26+00:00,Dorian Thompson Robinson wants to be in the Olympic Games. Hurdler or high jumper. He just showed off his leaping skills. UCLA has 55 points and bragging rights for a year.,0,6,Yes,en,no media
1462211935420641289,2021-11-21 00:11:06+00:00,The 48 points is the most UCLA has ever scored against USC in regulation.,0,23,Yes,en,no media
1462210401588981763,2021-11-21 00:05:00+00:00,Kings can't keep up with red-hot Hurricanes in 5-4 loss https://t.co/4t7z1JvODL,0,0,No,en,no media
1462206043857977344,2021-11-20 23:47:41+00:00,"Kings can’t keep up with red-hot Hurricanes in 5-4 loss
https://t.co/4t7z1Jedfb",0,0,No,en,no media
1462199071066574850,2021-11-20 23:19:59+00:00,Here’s video of the Dorian Thompson-Robinson in-game hat signing courtesy of Lupe Nuno. https://t.co/GtrpzfkhTs,0,28,Yes,en,video
1462197703652249601,2021-11-20 23:14:33+00:00,"Dorian Thompson-Robinson scores touchdown, gives fan a souvenir https://t.co/y6XgnAh8JS",0,0,No,en,no media
1462193142640250880,2021-11-20 22:56:26+00:00,Here’s the hat. I got the story let me get back to the press box. https://t.co/uPtxdVk6NK,0,59,Yes,en,photo
1462192260892684294,2021-11-20 22:52:55+00:00,RECESS: UCLA leads 28-17 after Dorian Thompson-Robinson finds his footing. The QB completed 10-of-14 passes after getting his first two passes intercepted and had four first-half TDs. https://t.co/nNLMhRqPHj,0,3,Yes,en,no media
1462191600671465478,2021-11-20 22:50:18+00:00,"First half of #USC-#UCLA is in the books: 

The Bruins lead 28-17 and would’ve led by more if not for a late TD from USC in a nightmarish second quarter. 

Dart: 12/25 for 133 yds, 1 INT

Ingram: 16 touches, 127 yards.",0,3,Yes,en,no media
1462189095543664641,2021-11-20 22:40:21+00:00,"Thompson-Robinson signed an autograph for a fan in the crowd after scoring that touchdown. 

For USC, in its home stadium, this is truly embarrassing. https://t.co/gMV9X2svHL",0,12,Yes,en,no media
1462182030737743875,2021-11-20 22:12:16+00:00,"Crowd has filled in nicely at Coliseum, must be the biggest of season. https://t.co/H4Y15XXNhc",0,2,Yes,en,photo
1462181461545689089,2021-11-20 22:10:01+00:00,"Chargers activate Joey Bosa, Drue Tranquill off COVID-19 list https://t.co/FfJNe9vSRg",7,2,No,en,no media
1462179627741310978,2021-11-20 22:02:43+00:00,USC vs. UCLA: QBs rack up three picks; Trojans lead Bruins 10-7 in second quarter https://t.co/mmHZUQeaOD,0,0,No,en,no media
1462171649571229711,2021-11-20 21:31:01+00:00,College football: No. 4 Ohio State routs No. 7 Michigan State https://t.co/A3zBYR7iMH,1,0,No,en,no media
1462156548793372677,2021-11-20 20:31:01+00:00,How LAFC plans to avoid Atlanta United-esque pitfalls after parting with Bob Bradley https://t.co/5SPOF55Ifk,0,0,No,en,no media
1462150004492148743,2021-11-20 20:05:01+00:00,Palisades' Max Fields wins City Section Division I cross-country title https://t.co/bCr1CAPmHz,1,0,No,en,no media
1462141448682364935,2021-11-20 19:31:01+00:00,Letters to Sports: Tales from the https://t.co/LwbVcIqXoG Arena coming soon https://t.co/ZxQacm0h0x,0,0,No,en,no media
1462123579085103108,2021-11-20 18:20:00+00:00,Clippers veteran Serge Ibaka put aside ego to hone game in G League https://t.co/Vo3fwbjMXb,3,0,No,en,no media
1462119804207251464,2021-11-20 18:05:00+00:00,High school girls' volleyball: State Championship results https://t.co/BMPkOYGyfv,1,0,No,en,no media
1462089608066441225,2021-11-20 16:05:01+00:00,"Chargers seek improved play, execution against Steelers https://t.co/xgAAvVVJYo",1,0,No,en,no media
1462059407018270729,2021-11-20 14:05:01+00:00,Hernández: LeBron James walks fine line with social justice and China https://t.co/fzBBqvmqG7,2,0,No,en,no media
1462029209631703053,2021-11-20 12:05:01+00:00,College football picks: UCLA beats rebuilding USC; Utah upsets Oregon https://t.co/x61Xs25a83,5,1,No,en,no media
1461999011108380679,2021-11-20 10:05:01+00:00,High school football: City and Southern Section semifinal results and updated pairings https://t.co/H8OZe4gZS4,0,0,No,en,no media
1461968809116512259,2021-11-20 08:05:00+00:00,Etiwanda is back playing defense and showing off promising young players https://t.co/5Fl8Ql4Tp8,0,0,No,en,no media
1461948680316100615,2021-11-20 06:45:01+00:00,"Mater Dei holds off Corona Centennial, will face Servite for title https://t.co/DBHmbU7tZ5",0,0,No,en,no media
1461945894031347716,2021-11-20 06:33:57+00:00,"Etiwanda is back playing defense and showing off promising young players
https://t.co/5Fl8QlmugG",0,0,No,en,no media
1461943645846839310,2021-11-20 06:25:01+00:00,San Pedro forces five turnovers to end Palisades' winning streak https://t.co/lYoSTFeLnr,1,0,No,en,no media
1461913444412710916,2021-11-20 04:25:00+00:00,High school girls’ tennis: Southern California Regional results and schedule https://t.co/YVcfC25ofI,0,0,No,en,no media
1461908414272053249,2021-11-20 04:05:01+00:00,Clippers start hot then fade behind lackluster shooting in loss to Pelicans https://t.co/LYILSKbtcI,0,0,No,en,no media
1461903380197085185,2021-11-20 03:45:01+00:00,Lakers ruin LeBron James' return with second-half collapse vs. Celtics https://t.co/bXNAYSoLRg,1,0,No,en,no media
1461898373879906309,2021-11-20 03:25:07+00:00,Lakers ruin LeBron James’ return with second-half collapse vs. Celtics https://t.co/bXNAYS7asG,1,1,No,en,no media
1461898298080464897,2021-11-20 03:24:49+00:00,"Clippers start hot then fade with lackluster shooting in loss to Pelicans
https://t.co/LYILSKt44g",3,1,No,en,no media
1461893462471557126,2021-11-20 03:05:36+00:00,Clippers will fall to 0-2 on this road trip and 9-7 overall after a loss to New Orleans. Only the Pelicans' third win this season and second at home.,0,2,Yes,en,no media
1461893314429472775,2021-11-20 03:05:01+00:00,USC vs. UCLA matchups: Trojans' Coliseum win streak in jeopardy against Bruins https://t.co/4Lc5HqDLnE,0,1,No,en,no media
1461886342632075267,2021-11-20 02:37:19+00:00,"New Orleans outscored the Clippers 29-14 in the third quarter and leads 72-69 entering the fourth.

Two games in a row the third has been a problem for LAC.",0,2,Yes,en,no media
1461885261961318405,2021-11-20 02:33:01+00:00,Lakers outscored 33-21 in third quarter to trail Celtics 93-82 end of third.,0,8,Yes,en,no media
1461884313394315267,2021-11-20 02:29:15+00:00,USC vs. UCLA matchups: Trojans’ Coliseum win streak in jeopardy against Bruins https://t.co/4Lc5Hqm9Z4,1,0,No,en,no media
1461877335246860289,2021-11-20 02:01:31+00:00,"Halftime: Clippers 55, Pelicans 43

PG: 12 points, 5 reb, 2 ast
Hartenstein: 9 points, 3 reb
Mann: 7 points
Kennard, Zubac, Batum all have 6.

Only 5 turnovers for LAC.",0,1,Yes,en,no media
1461866258991697922,2021-11-20 01:17:30+00:00,"Strong start for LeBron, 7 points, but even stronger start for AD, 15 points, as Lakers open 38-30 lead over Celtics end of first.",0,8,Yes,en,no media
1461853119906672646,2021-11-20 00:25:18+00:00,"The Dodgers announced some moves. 

Added to 40-man roster: Jacob Amaya, Eddys Leonard, James Outman, Michael Grove, and Jorbit Vivas.

DFA'd: BIlly McKinney and Zach Reks. 

40-man roster is at 40.",0,5,Yes,en,no media
1461848016978128903,2021-11-20 00:05:01+00:00,LeBron James will return from injury tonight for Lakers vs. Celtics https://t.co/ISa5EchORq,0,2,No,en,no media
1461845702896586752,2021-11-19 23:55:50+00:00,The King has arrived ... and will play. https://t.co/QCkNnoxfhW,0,2015,Yes,en,photo
1461845129665277956,2021-11-19 23:53:33+00:00,LeBron James will return from injury tonight for Lakers vs. Celtics https://t.co/ISa5EczpIY,10,1,No,en,no media
1461844621978259460,2021-11-19 23:51:32+00:00,Lakers say LeBron James is playing after missing almost 2 week with an abdominal strain,0,19,Yes,en,no media
1461840057388523522,2021-11-19 23:33:24+00:00,LeBron James starts pregame workout before Lakers play Celtics https://t.co/eGVILizvDv,0,23,Yes,en,video
1461839457368350727,2021-11-19 23:31:00+00:00,UCLA's Mac Etienne out for season after undergoing surgery for torn ACL https://t.co/pHz4hIxwuA,3,3,No,en,no media
1461838815778140166,2021-11-19 23:28:27+00:00,"We're having a Lakers pregame chat w/ @dylanohernandez &amp; @BA_Turner from our @latimessports team 🏀

 🔊 Tune in! 🔊
https://t.co/WDbl0oXvj2",0,4,Yes,en,no media
1461833147121766403,2021-11-19 23:05:56+00:00,Vogel said LeBron James still game time decision,0,8,Yes,en,no media
1461832917047513091,2021-11-19 23:05:01+00:00,'Time for a change': How the Angels wooed Noah Syndergaard away from the Mets https://t.co/I0BfSiABoa,1,2,No,en,no media
1461828844118151168,2021-11-19 22:48:50+00:00,"UCLA suffers a blow to its frontcourt with Mac Etienne out for the season
https://t.co/pHz4hIP7m8",2,4,No,en,no media
1461825244872646659,2021-11-19 22:34:32+00:00,"Inside the #Angels pursuit of Noah Syndergaard, including details on the team’s vetting process, a 3-hour dinner w/ Perry Minasian &amp; his expectations for 2022

""I trust that what they saw, they’re going to be able to fix, and I’ll get back to my old self.""
https://t.co/wTFghFF9UJ",0,15,Yes,en,no media
1461822316300570627,2021-11-19 22:22:54+00:00,"""Gotta keep the guys engaged, make sure that we're trying to make progress and improve. I want them to enjoy it along the way. When the bump in the road does hit, that is when you'll get tested the most."" 

Coach Cronin, on keeping his team sharp and focused https://t.co/EpyzvPYyrp",0,12,Yes,en,no media
1461821556447854595,2021-11-19 22:19:53+00:00,Chargers’ secondary will receive a boost Sunday with the returns of cornerback Michael Davis and safety Nasir Adderley https://t.co/yVIWWh8FGi,0,0,No,en,no media
1461819982598205440,2021-11-19 22:13:37+00:00,"UCLA vs. USC roundtable: Dorian Thompson-Robinson, Jaxson Dart can deliver fireworks https://t.co/9MK8gFhB9G",2,3,No,en,no media
1461819075814961160,2021-11-19 22:10:01+00:00,"Antonio Brown is vaccinated and willing to get booster on live TV, his attorney says https://t.co/IaoYqvbXgz",1,0,No,en,no media
1461796615342247946,2021-11-19 20:40:46+00:00,Join @dylanohernandez and @BA_Turner today at 3:30 for a #Lakers v. #Celtics pregame chat on @TwitterSpaces https://t.co/BgaqOgUK73,0,3,No,en,no media
1461796371846074373,2021-11-19 20:39:48+00:00,"Over the last year @latimessports has drawn on the talents of non-sports staffers @GustavoArellano  @mollyhf @kurtisalee @JennyJarvie, to name a few, to tell great sports stories. In the last 48 hours, that cross-newsroom flex has included these three gems: (1/4)",0,9,Yes,en,no media
1461794159111680005,2021-11-19 20:31:01+00:00,'Not surprised at all': Athletes react to Kyle Rittenhouse not-guilty verdict https://t.co/IOKJpK17tn,1,0,No,en,no media
1461749367065305089,2021-11-19 17:33:01+00:00,"Talen Horton-Tucker is a 20-year-old on a team of 30-somethings. Coaches and teammates rave about his potential.

The third-year guard is just starting to show his worth to the Lakers, scoring 17, 28 and 25 points in his first games back from injury. 

https://t.co/pU0lopUNg0",1,0,No,en,no media
1461748035470327809,2021-11-19 17:27:44+00:00,The takes don’t get any colder. ❄️❄️❄️ https://t.co/qjFr5TsRNe,0,4,Yes,en,no media
1461748018571452417,2021-11-19 17:27:40+00:00,#Chargers latest: “You can’t let off the gas. You got to make sure that you over-communicate to guys to make sure that we can get off the field and get the offense the ball back.” https://t.co/PoHy3Bawyb,0,2,Yes,en,no media
1461739099610513409,2021-11-19 16:52:13+00:00,⚡️ “How Shohei Ohtani became AL MVP ... and why those around him think his success is sustainable” by @latimessports https://t.co/gKKOhRfhPg,6,3,No,en,no media
1461734263335063552,2021-11-19 16:33:00+00:00,Top college football games to watch this weekend https://t.co/IL1IBBHWCx,0,0,No,en,no media
1461729808266584066,2021-11-19 16:15:18+00:00,"When the #Angels spoke to Ohtani about eliminating the days off built into his schedule, he felt that was their way of telling him this was his last chance to prove he could be a two-way player. 

What started as a do-or-die season became an historic one.
https://t.co/ahKhcfYG9R",0,9,Yes,en,no media
1461729690230480902,2021-11-19 16:14:50+00:00,"ICYMI, full @latimessports coverage of Shohei Ohtani's MVP

The unanimous vote: https://t.co/SChuoZ19j7

How he mastered his two-way potential (and how he can sustain it): https://t.co/Z6UecFRZH2

@dylanohernandez on Ohtani's dream-come-true honor: https://t.co/MNvPwQYwMO https://t.co/FG4JQfOzbL",0,76,Yes,en,no media
1461728895787360263,2021-11-19 16:11:41+00:00,LeBron james is game time decision for Lakers vs Celtics,0,61,Yes,en,no media
1461727587974057985,2021-11-19 16:06:29+00:00,"Nov. 20, 1982. Cal and Stanford. 

@RaineyTime was there. Revisit “The Play” with him:

 ""My small flight of insanity was not unique that late fall afternoon in Berkeley. All around us on the field at California Memorial Stadium, others came unhinged.""  https://t.co/k05U9oHJOc",0,7,Yes,en,no media
1461727273308934146,2021-11-19 16:05:14+00:00,Super fun read. James Rainey was a Cal student 39 years ago and witnessed 'The Play' against Stanford. He tracks down the key players and they reminisce.  https://t.co/xCBjgpLXe8,0,6,Yes,en,no media
1461727218267217920,2021-11-19 16:05:01+00:00,"Chargers vs. Steelers: Betting lines, odds, spread and how to watch https://t.co/3yiySPILC6",0,0,No,en,no media
1461721624638488580,2021-11-19 15:42:47+00:00,"Is this the lowest energy ebb in recent rivalry history?

Is Chip Kelly done if he loses this game?

Would winning this game redeem USC's lost season at all?

@Ryan_Kartje, @latbbolch and @thucnhi21 tackle these questions and more.

https://t.co/MT4TcUuJ6A",3,4,No,en,no media
1461721623115886592,2021-11-19 15:42:47+00:00,"Kedon Slovis, who torched the Bruins for nine touchdowns and nearly 900 passing yards during USC’s previous two wins in the rivalry, is sidelined by a lower leg injury. So freshman quarterback Jaxson Dart will make his first start vs. the Bruins.

https://t.co/RF8xbfscKb https://t.co/KAYTbx4V6R",1,0,No,en,photo
1461721620381196292,2021-11-19 15:42:46+00:00,"UCLA quarterback Dorian Thompson-Robinson posted two of the best performances of his career in the last two iterations of the rivalry.

Yet he’s never been able to beat USC as a starter.

https://t.co/RF8xbfscKb https://t.co/STeKcUiB5z",1,0,No,en,photo
1461721616853843970,2021-11-19 15:42:45+00:00,"The stakes aren't that high in tomorrow's UCLA-USC game.

Neither team is playing for much on paper. 

A conference title is out of reach.

But amid a disappointing season, maybe there’s still some solace to be had for either in beating a bitter rival.

https://t.co/RF8xbfscKb",2,0,No,en,no media
1461719167078436877,2021-11-19 15:33:01+00:00,Lakers newsletter: Will Talen Horton-Tucker still start when LeBron returns? https://t.co/Gbb0JJ51RW,0,0,No,en,no media
1461712117111865351,2021-11-19 15:05:00+00:00,"For both USC and UCLA, crosstown rivalry game has provided jolt to lifeless season https://t.co/Z8oKDMbtLC",1,1,No,en,no media
1461709358719401991,2021-11-19 14:54:03+00:00,"Was this all just a stunning but unsustainable burst never to be seen again? Or can Ohtani actually it into an annual occurrence?

 As long as he stays healthy, there isn’t much doubt among those closest to Ohtani that he’ll be able to do it all again.

https://t.co/2WCVS2U7Aw",18,1,No,en,no media
1461709357318492162,2021-11-19 14:54:02+00:00,"Ohtani will be eligible for free agency after two more seasons.

He knows what he wants for his career. 

The challenge for the Angels will be to convince him they can help him realize his visions, @dylanohernandez writes.

https://t.co/MtLvEYowTa",21,2,No,en,no media
1461709356076920838,2021-11-19 14:54:02+00:00,"Ohtani is the fourth Angels player to win the award,  the second Japanese-born recipient and the 19th unanimous selection.

No past winner, however, had a season quite like this, as Ohtani mastered his two-way role after three injury-plagued seasons.

https://t.co/Qnvm4v8D2b",29,3,No,en,no media
1461709353631760384,2021-11-19 14:54:01+00:00,"🧵Angels two-way Shohei Ohtani is unanimous choice for the American League MVP.

Here's our coverage ...

https://t.co/HjGiOVMEXR https://t.co/fM1qxvGNDY",343,63,No,en,photo
1461697020985593857,2021-11-19 14:05:01+00:00,The Sports Report: Shohei Ohtani crowns historic season with AL MVP award https://t.co/q0lq7G0D0h,5,3,No,en,no media
1461666818771279887,2021-11-19 12:05:00+00:00,"UCLA vs. USC roundtable: Dorian Thompson-Robinson, Jaxson Dart can deliver fireworks https://t.co/9MK8gF00i8",0,0,No,en,no media
1461586290722410498,2021-11-19 06:45:01+00:00,"Troy Terry extends scoring streak, but Ducks fall short to Hurricanes https://t.co/Jv9QHwnWRH",0,0,No,en,no media
1461582013559803911,2021-11-19 06:28:01+00:00,The best thing about Thursday for the Clippers was the postgame spread from Rendezvous.  https://t.co/9d3xopQjwT,0,1,Yes,en,no media
1461581258274881539,2021-11-19 06:25:01+00:00,"Dusty Stromer, Jayden Harper lead Sherman Oaks Notre Dame past Heritage Christian https://t.co/14cMATQs9d",3,0,No,en,no media
1461575970138333184,2021-11-19 06:04:00+00:00,IImar’I Thomas leads No. 20 UCLA to victory over Cal State Northridge https://t.co/b5kn4qBwQV,4,0,No,en,no media
1461575734292451329,2021-11-19 06:03:04+00:00,.@Jack_A_Harris on how Shohei Ohtani prepared for his MVP season and whether he can repeat his performance in the future: https://t.co/J6Vp95G5Wp,0,9,Yes,en,no media
1461569716640628737,2021-11-19 05:39:09+00:00,"Ducks lose to Carolina, 2-1. Ends Ducks' eight-game win streak and streak of points in 10 straight (8-0-2). Pretty good pace by both teams. No. 1 star is Carolina goalie Frederik Andersen, a former Duck...he stopped 31 shots.",0,4,Yes,en,no media
1461565239774769152,2021-11-19 05:21:22+00:00,"Before leaving Japan for the majors four years ago, Shohei Ohtani said, “As long as you’re playing baseball, I think it’s natural to want to become the No. 1 player.”

This year, he became that player. Tonight, he was named AL MVP.

https://t.co/ahKhcfYG9R",0,78,Yes,en,no media
1461556092278878218,2021-11-19 04:45:01+00:00,Patriots overwhelm Falcons to win their fifth consecutive game https://t.co/AARnzJa1u5,0,0,No,en,no media
1461551058992435204,2021-11-19 04:25:01+00:00,Hernández: Shohei Ohtani achieves dream to be the best. Will the Angels help him sustain it? https://t.co/DngCHkDLia,7,1,No,en,no media
1461550673149890567,2021-11-19 04:23:29+00:00,Shohei Ohtani achieves dream to be the best. Will the Angels help him sustain it? https://t.co/DngCHkm9TA,3,1,No,en,no media
1461546025810808834,2021-11-19 04:05:01+00:00,Clippers can't stop Ja Morant's scoring surge in loss to Grizzlies https://t.co/120RsQ4ztc,1,1,No,en,no media
1461541695531544579,2021-11-19 03:47:49+00:00,"Many sports have sought to stay in China’s good graces by keeping quiet on sensitive issues.
Women’s tennis is doing the opposite: pressuring China to prove the safety &amp; freedom of a player who crossed a red line, even if it then loses China’s market. https://t.co/93zlzMm6Ln",0,101,Yes,en,no media
1461540992872591364,2021-11-19 03:45:01+00:00,High school boys’ water polo: Southern California Regional results and updated pairings https://t.co/uxLqbutP7d,0,0,No,en,no media
1461540365144526848,2021-11-19 03:42:31+00:00,Clippers can’t stop Ja Morant’s scoring surge in loss to Grizzlies https://t.co/120RsQmakK,1,0,No,en,no media
1461538462209773568,2021-11-19 03:34:58+00:00,"Ducks winger Troy Terry extends his point streak to 16 straight games, converting a rebound for his 12th goal this season. Getzlaf gets career point 1,001. Ducks 1-1 vs Carolina.",0,1,Yes,en,no media
1461538142448615426,2021-11-19 03:33:41+00:00,"Ty Lue referenced in his postgame comments the way the team didn't quick enough decisions offensively. Too many dribbles for no reason, he said.",0,1,Yes,en,no media
