id,created_at,text,favorite_count,retweet_count,is_retweet,language,media_type
1453073524097048577,2021-10-26 18:58:19+00:00,"Rams roundtable: @LATimesklein and @LATimesfarmer discuss Stafford vs. Goff ... er, Rams vs. Lions. Plus, where does Cooper Kupp rank among NFL receivers. And did the winless Lions expose the 6-1 Rams just a little bit?

https://t.co/7EXRAs9RkC",6,2,No,en,no media
1453066653911207938,2021-10-26 18:31:01+00:00,Lincoln High cancels football game against Cathedral Catholic in response to racial incident from April https://t.co/MKAanzfGF1,1,0,No,en,no media
1453045007867338754,2021-10-26 17:05:00+00:00,Explaining how Southern Section and City Section football playoffs will work https://t.co/c04xLxu6aX,2,1,No,en,no media
1453021858912145415,2021-10-26 15:33:01+00:00,Clippers takeaways: Paul George's eight steals help seal 'shellacking' of Blazers https://t.co/2d4afUwydB,0,1,No,en,no media
1453014811634245632,2021-10-26 15:05:01+00:00,Soccer newsletter: Who is winning MLS' version of moneyball this season? https://t.co/5e3finx4Dl,0,0,No,en,no media
1453010140525961226,2021-10-26 14:46:27+00:00,"The Astros might be past it, but much of baseball clearly is not.

As successful as they’ve remained since that 2017 season, as much as their roster has turned over since then, the story continues to hang over their heads.

https://t.co/7XbxDgJcQS https://t.co/2f1i4yYkpq",2,0,No,en,photo
1453010133940899849,2021-10-26 14:46:26+00:00,"And yet ...

“I don’t think that’s their main source of motivation,” said Astros manager Dusty Baker, who was hired in the aftermath of the cheating scandal.

“You can only be driven by negative motivation so far. I think this team is way, way past that.”

https://t.co/7XbxDgJcQS https://t.co/6ctjmgDBJr",1,1,No,en,photo
1453010125183201292,2021-10-26 14:46:24+00:00,"A World Series triumph might go a long way toward silencing critics of the Houston Astros. 

A loss, however, would leave them with only the one tainted World Series title hanging above their left-field stands.

https://t.co/7XbxDgJcQS",1,1,No,en,no media
1453006757589135367,2021-10-26 14:33:01+00:00,NFL roundtable: Did Rams' win over Lions validate Stafford-Goff trade? https://t.co/Nl2c7P0fcJ,0,0,No,en,no media
1453001996911497226,2021-10-26 14:14:06+00:00,"Players did not appear to be angry.

They did not appear to be crushed.

If there was an outpouring of emotion to the Dodgers' season ending without a National League pennant, it was hidden from the public eye.

https://t.co/IaYB8fW76C https://t.co/YHt8CIpJFU",1,0,No,en,animated_gif
1453001985351983105,2021-10-26 14:14:03+00:00,"The Dodgers were drained. 

They were battered. 

They were incomplete.

A lack of organizational depth combined with bad injury timing, a relentless schedule, and faulty pitching plans all contributed to an early end to the Dodgers' historic season.

https://t.co/IaYB8fW76C",1,1,No,en,no media
1452999720343834633,2021-10-26 14:05:03+00:00,The grind to repeat as champions proved to be too much for Dodgers https://t.co/0iETlhJcVj,2,2,No,en,no media
1452984611085168658,2021-10-26 13:05:01+00:00,The Sports Report: Clippers get their first win of the season https://t.co/c1iFS6RVJf,1,0,No,en,no media
1452894017470046208,2021-10-26 07:05:01+00:00,Clippers get first win of season with rout over Trail Blazers https://t.co/3tDNkLmYAX,4,1,No,en,no media
1452866082276995074,2021-10-26 05:14:01+00:00,"To recap:

-- Clippers 21 steals are the team's most since 1991

-- Portland's 30 turnovers are the most by a Clippers opponent since 1996

-- Clippers' 37 assists are their most since 2015",0,20,Yes,en,no media
1452862545262379010,2021-10-26 04:59:58+00:00,"Ty Lue on the blowout:

""I just like our activity, I thought our activity was great. I thought Nico came out and set the tone.""",0,6,Yes,en,no media
1452861806465077253,2021-10-26 04:57:02+00:00,"The Clippers win their first game after a 116-86 blowout of Portland. They'll see these same Trail Blazers on Friday.

Clips (1-2) were led by Luke Kennard's 23 points. Reggie Jackson 18 points (on 20 shots) and Paul George 16 points (on 16 shots). They forced *30* turnovers.",0,4,Yes,en,no media
1452854908542078978,2021-10-26 04:29:37+00:00,Terance Mann would have never tried that last dribble and step-back three just two seasons ago. His development continues and he has 13 points off the bench.,0,6,Yes,en,no media
1452853751266566144,2021-10-26 04:25:01+00:00,Saints capitalize on Seahawks’ mistakes for 13-10 win https://t.co/mbYmUDhMB0,2,0,No,en,no media
1452852951836348418,2021-10-26 04:21:51+00:00,"After three quarters: Clippers 91, Blazers 61

Kennard: 20 points (7-8, 5-6 from 3)
Jackson: 18 (6-20, 3-15)
George: 16 (6-16, 2-8)
Hartenstein and Zubac each with 10",0,2,Yes,en,no media
1452851222587736066,2021-10-26 04:14:58+00:00,"Portland is all the way out of sorts. A pair of teammates just knocked into one another going for the same inbounds pass and it rolled out for their 20th turnover. 

Clippers 83, Blazers 52",0,3,Yes,en,no media
1452848802637881350,2021-10-26 04:05:21+00:00,"Paul George just tipped his eighth steal of the night, a career high.",0,2,Yes,en,no media
1452848787546796032,2021-10-26 04:05:18+00:00,Paul George starts the second half making cleaner decisions than in the first. He's found Zubac on a lob and Reggie Jackson on the break for a layup in a 2-on-1 situation.,0,1,Yes,en,no media
1452842324896239619,2021-10-26 03:39:37+00:00,"Halftime: Clippers 56, Portland 42

There isn't much difference between three-point shooting (LAC 8-26, POR 6-23) but the Clippers are shooting 71% inside the arc.",0,1,Yes,en,no media
1452840174103060487,2021-10-26 03:31:04+00:00,"8 Clippers turnovers 19 minutes into this game after 7 apiece in each of their last two games. 

Paul George and Zubac don't look in sync on offense. PG and Bledsoe each with  3 turnovers.",0,2,Yes,en,no media
1452837816451231747,2021-10-26 03:21:42+00:00,Luke Kennard has 13 points and two assists that have led to four more points in his 11 minutes off the bench. He checks out.,0,1,Yes,en,no media
1452833819938078724,2021-10-26 03:05:49+00:00,"End of 1 at Staples:

Clippers 31, Blazers 17

Blazers went nearly five minutes between field goals late in the quarter against the Clippers' bench unit.",0,5,Yes,en,no media
1452833717206994944,2021-10-26 03:05:25+00:00,"Justise Winslow was a DNP in Game 2. He's serving as Batum's backup at the 4 it would appear, with Morris out.",0,1,Yes,en,no media
1452833684063760384,2021-10-26 03:05:17+00:00,"Kings are shut out by Blues, 3-0 https://t.co/TTqIYVptnp",0,0,No,en,no media
1452824370691276806,2021-10-26 02:28:16+00:00,"The Dodgers are out but plenty of Southern California players on the Braves to root for in World Series: Max Fried (Harvard-Westlake), Tyler Matzek (Capistrano Valley), Freddie Freeman (El Modena), Travis d'Arnaud (Lakewood).",0,14,Yes,en,no media
1452823548825833476,2021-10-26 02:25:00+00:00,"Astros don't want to talk about cheating or the 2017 World Series, just this one https://t.co/Yo4PBLoIT1",3,0,No,en,no media
1452818518345404424,2021-10-26 02:05:01+00:00,"After long break, Chargers regaining health in preparing for Patriots https://t.co/XjEBaIKQLl",1,0,No,en,no media
1452804052492816386,2021-10-26 01:07:32+00:00,"COVID-19 and the gentrification in South Los Angeles have cooled the Dorsey-Crenshaw rivalry, one of the most storied clashes in high school football. But Friday's chapter could bring about a new era. 

My latest for @latimessports:

https://t.co/tZT5dqpU7x",0,1,Yes,en,no media
1452803417659879438,2021-10-26 01:05:01+00:00,Commentary: Carson Palmer (oops) adds Mike Tomlin to the USC coaching mix. Could it happen? https://t.co/4FWrwsEFwR,5,0,No,en,no media
1452800176314220544,2021-10-26 00:52:08+00:00,Ty Lue said he isn’t sure how close Serge Ibaka is to returning to a game. But he added Ibaka is progressing well.,0,1,Yes,en,no media
1452800158773698565,2021-10-26 00:52:04+00:00,"Is preparing for a team coached by one of your best friends different than any other team? Ty Lue on Chauncey Billups’ Blazers: “It’ll be a little different,” he said with a grin behind his mask.",0,1,Yes,en,no media
1452793590485192708,2021-10-26 00:25:58+00:00,This week’s assignment… https://t.co/bCJeWhR517,0,1,Yes,en,photo
1452793373656444928,2021-10-26 00:25:06+00:00,"Mike Tomlin and USC? Like, for real?

Come on, Carson, haven't USC fans endured enough? Let's not set them up for further disappointment in this coaching search that should ultimately bring fresh hope to Troy. Column @latimes:  
https://t.co/q1UhernigA",0,9,Yes,en,no media
1452783943241986053,2021-10-25 23:47:38+00:00,The Lakers list LeBron James on injury report as probable for Spurs game tomorrow night with right ankle soreness.,0,9,Yes,en,no media
1452776715831242754,2021-10-25 23:18:54+00:00,"McVay said Young trade was ""financially driven"" and provides flexibility for more moves.",0,3,Yes,en,no media
1452760516036743168,2021-10-25 22:14:32+00:00,Chip Kelly contends officials blew field-goal call in UCLA's 34-31 loss to Oregon https://t.co/T4wYCUkNNu,0,10,Yes,en,no media
1452755568846786560,2021-10-25 21:54:53+00:00,"Shohei Ohtani is a Silver Slugger finalist (surprise, surprise) https://t.co/RHJLh5nPtc",0,24,Yes,ro,no media
1452743545891196939,2021-10-25 21:07:06+00:00,"Jansen has 350 career saves and plenty of mileage, but he could receive lucrative two- or three-year offers.

Jansen has expressed his desire to be a Dodger for life, but there are no guarantees. He will return to L.A. only if the Dodgers want him back.

https://t.co/n08bWKrIdl https://t.co/nUflDEwtck",2,0,No,en,photo
1452743542305001473,2021-10-25 21:07:05+00:00,"As he walked off the mound after a scoreless eighth inning Saturday night, Kenley Jansen headed into a winter of uncertainty. 

His contract with the Dodgers is up, and he's set to become a free agent.

https://t.co/n08bWKJj4T",3,1,No,en,no media
1452739183886274561,2021-10-25 20:49:46+00:00,"Kenny Young made seven tackles, sacked Jared Goff and also had a key fourth-down stop during the Rams’ 28-19 victory over Detroit on Sunday.

Today he was traded to Denver, along with a 2024 seventh-round pick, for a 2024 sixth-round pick.

https://t.co/eurdPc2OtC",0,1,No,en,no media
1452737027552600064,2021-10-25 20:41:12+00:00,"And here's how you can pre-order ""Paradise Found,"" the story of a fire-ravaged high school football team and its resurrection. https://t.co/YeUiCwSh17",0,8,Yes,en,no media
1452733897460965376,2021-10-25 20:28:46+00:00,"All of it pales, of course, in comparison to the Bauer debacle — not because it prevented the Dodgers from repeating, but because it severely damaged the reputation of the team and its management.

https://t.co/XiXDWZb5cC https://t.co/4ZCtCCrK5m",4,1,No,en,photo
1452733891064721411,2021-10-25 20:28:44+00:00,"It is jarring to realize how much actually went wrong for the Dodgers this year.

It is a testament to how strong a foundation Andrew Friedman has built that the Dodgers won 106 games this year, with their weaknesses largely obscured until the postseason.

https://t.co/XiXDWZb5cC https://t.co/bOPvW0vR21",5,1,No,en,photo
1452727669339086848,2021-10-25 20:04:01+00:00,Rams trade inside linebacker Kenny Young to Broncos for draft pick https://t.co/a2gs02BjRY,1,0,No,en,no media
1452719366223679497,2021-10-25 19:31:01+00:00,UCLA's Dorian Thompson-Robinson doesn't throw at practice two days after injury https://t.co/SLEGepTMZQ,7,4,No,en,no media
1452718428645593090,2021-10-25 19:27:18+00:00,"Also from UCLA practice this morning:

During the portion of drills open to reporters, Thompson-Robinson never threw a pass to test the arm he apparently injured Saturday late in UCLA’s loss to Oregon.

https://t.co/avGKtXlk9z",0,1,No,en,no media
1452718427420848128,2021-10-25 19:27:17+00:00,"UCLA lost to Oregon by three points — or did it?

Chip Kelly said Monday kicker Nicholas Barr-Mira’s 35-yard field goal that was ruled wide left in the second quarter appeared to have gone through the uprights after he watched replays of the kick.

https://t.co/63Y1mBPxcS",6,1,No,en,no media
1452709950812147712,2021-10-25 18:53:36+00:00,Learn all about strict guidelines and protocols that Bob Baffert must follow to run in Breeders' Cup. https://t.co/d4ARn1mHVc,0,9,Yes,en,no media
1452704266825748486,2021-10-25 18:31:01+00:00,"Bob Baffert accepts 24-hour security with body cams, strict testing at Breeders' Cup https://t.co/Boh34YjGLP",0,1,No,en,no media
1452697722830692357,2021-10-25 18:05:01+00:00,Chip Kelly contends officials blew field-goal call in UCLA's 34-31 loss to Oregon https://t.co/pOA3ZJhKEI,1,0,No,en,no media
1452667272041013260,2021-10-25 16:04:01+00:00,NBA milestone and 28 points: Carmelo Anthony had 'a hell of a night' for Lakers https://t.co/Z0fpSMFL5n,1,0,No,en,no media
1452663806534963200,2021-10-25 15:50:15+00:00,"Via @LATimesfarmer “Goff and Stafford aren’t operating in a vacuum, so it’s a little tough to perfectly compare them. They’re both driving different offenses. This is Ford versus Ferrari.”https://t.co/zErcK6vYoB",0,6,Yes,en,no media
1452660838523760644,2021-10-25 15:38:27+00:00,"It was on the same side of the court that James so badly sprained his ankle that he missed 26 games last year.

Just as he did last year, James winced, stood up and re-laced his sneakers. But this time he was able to walk it off and remained in the game.

https://t.co/0rlCZvVa6N https://t.co/UUQuX8bDpJ",0,0,No,en,photo
1452660833264144386,2021-10-25 15:38:26+00:00,"One moment could’ve meant disaster for the Lakers

Tangled with a group of midair bodies, LeBron James landed and immediately grabbed at the lower half of his right leg. 

“Not again,” James thought.

https://t.co/0rlCZvVa6N",0,0,No,en,no media
1452660828621217795,2021-10-25 15:38:25+00:00,"Anthony led the Lakers in scoring with 28 points, going 6 for 8 from three-point range, to help pull out a 121-118 win over the Grizzlies.

“What a better night to reach ninth [than] with a win, the way that we needed a win tonight,” he said.

https://t.co/RhcZDzmzZM https://t.co/66oiz5Q09V",0,0,No,en,photo
1452660821398458368,2021-10-25 15:38:23+00:00,"Carmelo Anthony hit a 27-foot three-point shot during the third quarter last night to move past Moses Malone for ninth on the NBA’s all-time scoring list.

But Anthony did more than make history on a night when the Lakers were in real need of a victory.

https://t.co/RhcZDzEaRk",15,3,No,en,no media
1452659471067619341,2021-10-25 15:33:01+00:00,Prep Rally: Crenshaw vs. Dorsey could reinvigorate one of the city’s most famous rivalries https://t.co/uiU74gyWsd,1,0,No,en,no media
1452652431129686026,2021-10-25 15:05:03+00:00,Special teams needs special attention: Takeaways from Rams' 28-19 win over Lions https://t.co/8wwVH9Gwd1,0,0,No,en,no media
1452650345369268226,2021-10-25 14:56:45+00:00,"The parade that never was: The lament of the 2020 champion Dodgers, and the city in which they played.

The Dodgers' last parade: 1988. 
 https://t.co/vbWIXyKw0w",0,13,Yes,en,no media
1452649528050388993,2021-10-25 14:53:31+00:00,"In Los Angeles, the hurt from not making this year’s World Series will heal quickly. 

But the hurt from not celebrating last year’s title will endure for fans and the Dodgers, who had weaved the lure of a parade into their motivation to repeat.

https://t.co/wyLdFw78Qc https://t.co/GYaMMSWjJ6",2,0,No,en,photo
1452649524975919104,2021-10-25 14:53:30+00:00,"In the minutes after the last out of the 2020 World Series, Mayor Garcetti had promised some sort of celebration, if not a parade. 

It never happened. 

The 2021 World Series is here, the Dodgers are not in it, and the time for a parade has passed.

https://t.co/wyLdFw78Qc",5,5,No,en,no media
1452646716117639168,2021-10-25 14:42:20+00:00,"Dodgers president of baseball operations Andrew Friedman said in a text Sunday:

“Dave has been a big part of our past success and we fully expect him to be a large part of our future success as well.” 

https://t.co/uPhiTGcqhm https://t.co/hLJQtqLSlL",2,0,No,en,photo
1452644848616439813,2021-10-25 14:34:55+00:00,"“I know I got another year left and it’s just kind of expecting, hoping, that they come to me and we can work something out, I guess,” Roberts said Sunday. 

“And, if not, you just kind of do your job and play out the contract.”

https://t.co/tSGajRVS0I https://t.co/36W7hLzCwe",3,1,No,en,photo
1452644845672009732,2021-10-25 14:34:54+00:00,"Dodgers manager Dave Roberts has one year left on his contract.

He said he has not talked with the organization regarding an extension but expects to manage the team in 2022 whether a new deal is reached or not.

But he prefers a contract extension.

https://t.co/tSGajRVS0I",9,3,No,en,no media
1452644371388669953,2021-10-25 14:33:01+00:00,The parade that never was: the lament of the 2020 champion Dodgers https://t.co/3rUgo40WKn,1,0,No,en,no media
1452642459956039680,2021-10-25 14:25:25+00:00,"Hope you had a great weekend, we're live!

On the show today: Bill Shaikin (@BillShaikin), and Carson Palmer

☎️: 877-DP-SHOW

✉️: DP@DanPatrick.com

📺: https://t.co/fyhnteowTt

🔈: https://t.co/oF4IFRXSsV https://t.co/gyFXEigld0",0,3,Yes,en,no media
1452641462621933568,2021-10-25 14:21:28+00:00,"Special teams in need of special attention: Takeaways from Rams’ 28-19 win over Lions https://t.co/FZMTAj9zi1

Rams’ 28-19 victory over Detroit Lions by the numbers
https://t.co/P2eOBEMAS8

Top photos from the game https://t.co/ja7HLngljM https://t.co/Zzp1vx0RvP",0,0,No,en,photo
1452641458628927488,2021-10-25 14:21:27+00:00,"When the Lions needed the big play from Goff, the huge throw under a massive surge of pressure, they didn’t get it. 

That’s OK. Most NFL quarterbacks wouldn’t be able to make that play.

The Rams, however, got those throws from Stafford.

https://t.co/ONP2jXjddJ https://t.co/vpzBSBvnYP",0,0,No,en,photo
1452641451544756224,2021-10-25 14:21:25+00:00,"Goff accounted for himself pretty well.

This could have gone so much worse for the former Rams QB.

But what we saw Sunday is the difference between a capable and worthy NFL quarterback in Goff, and an elite one in Stafford, @LATimesfarmer writes.

https://t.co/ONP2jXjddJ",0,0,No,en,no media
1452641449997045763,2021-10-25 14:21:25+00:00,"Goff and Stafford were ready to move on after a week of  constant questions about the emotional toll of playing against their former teams for the first time.

https://t.co/jYMYzWHHTT https://t.co/BTmcQrQ6h1",0,0,No,en,photo
1452641447371370502,2021-10-25 14:21:24+00:00,"The game took place months after the teams essentially swapped quarterbacks.

Rams QB Matthew Stafford passed for 334 yards and three touchdowns. But Jared Goff had the Lions on the brink of an upset until the final minutes. 

https://t.co/jYMYzWHHTT",0,0,No,en,no media
1452641445446176774,2021-10-25 14:21:24+00:00,"🧵The Rams improved to 6-1 with a tougher-than-expected 28-19 victory over the winless Detroit Lions yesterday at SoFi Stadium. 

Here's our coverage ... https://t.co/8L9xZjg9ca",1,1,No,en,photo
1452637330553065472,2021-10-25 14:05:02+00:00,"The Sports Report: Lakers win, Rams win https://t.co/Dwc5mTqM29",0,0,No,en,no media
1452622240613388297,2021-10-25 13:05:05+00:00,NFL Week 8 best bets: Three games with intriguing early odds https://t.co/Vfqzbrnc1G,6,2,No,en,no media
1452504880396992519,2021-10-25 05:18:44+00:00,"LeBron said he was thinking ""Not again"" when he took that fall in the first half. Said he's a little sore still but hopeful with treatment that he'll be OK for Tuesday at SAS",0,2,Yes,en,no media
1452502491988303881,2021-10-25 05:09:14+00:00,Only 8 players have scored more points in the NBA than the Triborough Chess Club’s best basketball player. https://t.co/8kVgvl1idX,0,5,Yes,en,no media
1452498755052183557,2021-10-25 04:54:23+00:00,This was bonkers https://t.co/ppv4ZAasF5,0,2,Yes,en,no media
1452494211488440320,2021-10-25 04:36:20+00:00,"Quick story from Staples Center, where the zeroes on the clocks finally meant good news https://t.co/mB7qUwh37I",0,4,Yes,en,no media
1452491360314044416,2021-10-25 04:25:00+00:00,Carmelo Anthony hits milestone as Lakers get a LeBron scare and earn first win https://t.co/Av9OszXXEj,8,1,No,en,no media
1452490406306844672,2021-10-25 04:21:13+00:00,Carmelo Anthony hits milestone as Lakers survive a LeBron James injury scare to beat Grizzlies for first win of season https://t.co/Av9OsAfyvR,17,5,No,en,no media
1452486467033337862,2021-10-25 04:05:34+00:00,"Lakers win first game of season, a 121-118 victory over Memphis, behind 28 points from Melo, 22 from Ad, 19 from LeBron, 13 points and 13 assists from Russ.",0,13,Yes,en,no media
1452486076824707078,2021-10-25 04:04:01+00:00,Jared Goff and Lions put a scare in the Rams but can't put win on scoreboard https://t.co/ZoI9l2NnWU,1,0,No,en,no media
1452481650709860356,2021-10-25 03:46:25+00:00,Just some terrific individual defense from Anthony Davis tonight.,0,13,Yes,en,no media
1452481296291205120,2021-10-25 03:45:01+00:00,"Matthew Stafford, after week of Jared Goff questions, is the answer as Rams top Lions https://t.co/5QtGOKRvmI",1,1,No,en,no media
1452480357496852482,2021-10-25 03:41:17+00:00,"Matthew Stafford, after week of Jared Goff questions, is the answer as Rams top Lions https://t.co/5QtGOL96eg",3,3,No,en,no media
1452479451581730817,2021-10-25 03:37:41+00:00,Jared Goff and Lions put a scare in the Rams but can’t put win on scoreboard https://t.co/ZoI9l2vMyk,0,1,No,en,no media
1452475009658548224,2021-10-25 03:20:02+00:00,"Ja Morant is destroying the  Lakers' defense, scoring 27 points, handing out 10 assists to give Memphis a 90-87 lead over LA end of third.",0,8,Yes,en,no media
1452474306902958080,2021-10-25 03:17:15+00:00,"With his sixth basket of the game, a 3, Carmelo Anthony has passed Moses Malone on the NBA's all-time scoring list.",0,2,Yes,en,no media
1452466197082034178,2021-10-25 02:45:01+00:00,"Dave Roberts 'expecting, hoping' he can work out contract extension with Dodgers https://t.co/B6ltOtDeaH",10,3,No,en,no media
1452465050141089793,2021-10-25 02:40:28+00:00,"As of now, Dave Roberts would be a lame-duck manager in 2022. Will he be?

https://t.co/IxRNqTB2MY",0,18,Yes,en,no media
1452464111313248257,2021-10-25 02:36:44+00:00,"Dave Roberts ‘expecting, hoping’ he can work out contract extension with Dodgers https://t.co/B6ltOtUP2f",3,2,No,en,no media
1452464048042242050,2021-10-25 02:36:29+00:00,"Russ has 9 points, 10 assists, AD 13  points, 7 rebounds, Melo 10 points as Lakers open 62-56 lead over Memphis at the half",0,22,Yes,en,no media
1452463557480640513,2021-10-25 02:34:32+00:00,Russ made his first 3 of the season after missing his first 8.,0,2,Yes,en,no media
1452461240794550276,2021-10-25 02:25:19+00:00,"LeBron is up and walking off whatever happened, re-lacing his shoes as he stays in the game",0,3,Yes,en,no media
1452461164080861185,2021-10-25 02:25:01+00:00,Ethan Garbers' high school coach isn't surprised by UCLA QB's fearlessness https://t.co/5PR7w1Clu0,32,5,No,en,no media
1452460833317920770,2021-10-25 02:23:42+00:00,LeBron James is down and holding his right leg.,0,3,Yes,en,no media
1452459921157414912,2021-10-25 02:20:05+00:00,Ethan Garbers’ high school coach isn’t surprised by UCLA QB’s fearlessness https://t.co/5PR7w1kK5q,1,0,No,en,no media
1452457561207107587,2021-10-25 02:10:42+00:00,"Lakers lead Memphis 29-24 end of first behind 10 points from AD, 5 assists from Russ and 6 points, 4 rebounds, 2 blocks from DJ.",0,3,Yes,en,no media
1452456129800331264,2021-10-25 02:05:01+00:00,Photos: Rams defeat Lions in Matthew Stafford vs. Jared Goff showdown https://t.co/VuQ9vgy3yy,2,0,No,en,no media
1452455877827612672,2021-10-25 02:04:01+00:00,Rams' 28-19 victory over Detroit Lions by the numbers https://t.co/LhB3Jfxnbp,1,0,No,en,no media
1452454884062629890,2021-10-25 02:00:04+00:00,"Donte Williams said Saturday that it didn’t matter that USC had two weeks to prepare for Notre Dame because “teams still make mistakes.”

On Sunday, when asked why ND had several long drives, he explained that the Irish had two weeks to prepare for their defense.

Hmm.",0,5,Yes,en,no media
1452452539375390722,2021-10-25 01:50:45+00:00,"Lakers slow to get back on defense, down 10-4, time out Vogel.",0,9,Yes,en,no media
1452441029341290498,2021-10-25 01:05:01+00:00,High school field hockey: Tournament of Champions schedule and results https://t.co/v2ojAUpgY9,1,1,No,en,no media
1452425176608608261,2021-10-25 00:02:01+00:00,NFL Week 7: Joe Burrow leads Bengals past Ravens; Titans defeat Chiefs https://t.co/LDXHFzHSe1,0,0,No,en,no media
1452417375874191361,2021-10-24 23:31:01+00:00,High school football: Week 10 schedule https://t.co/DCFb8CBhco,0,0,No,en,no media
1452414078782099457,2021-10-24 23:17:55+00:00,Rams hold off upset bid by Jared Goff and Lions in 28-19 victory https://t.co/1Ge9fEtyiD,2,0,No,en,no media
1452407775338790914,2021-10-24 22:52:52+00:00,"A red zone interception for the birthday boy @jalenramsey! 🎂 #RamsHouse

📺: #DETvsLAR on FOX
📱: NFL app https://t.co/akofcdzydw",0,370,Yes,en,video
1452402274513342475,2021-10-24 22:31:01+00:00,"Column: In battle of top two, Mater Dei earns the win with a twist https://t.co/EtRxFKlVOc",1,0,No,en,no media
1452398940075151360,2021-10-24 22:17:46+00:00,"Love this by @dave_schilling: ""In 2021, nothing communicates civic pride quite like a Dodger hat... The Dodgers unite us and are the easiest thing in L.A. to talk about with strangers because, in many ways, they are synonymous with the city itself."" https://t.co/5l5cpwT2s8",0,6,Yes,en,no media
