id,created_at,text,favorite_count,retweet_count,is_retweet,language,media_type
1457786251654823944,2021-11-08 19:05:01+00:00,NFL Week 10 best bets: Chiefs vs. Raiders among games with intriguing odds https://t.co/usrQMSeXYh,1,0,No,en,no media
1457763097758867469,2021-11-08 17:33:01+00:00,Proposed NCAA constitution would give more power to schools https://t.co/jDfaFv2ogL,1,1,No,en,no media
1457760167357870082,2021-11-08 17:21:22+00:00,"Every player who appeared in the Bruins’ NCAA tournament run returns for a 2021-22 season that starts Tuesday at Pauley Pavilion against Cal State Bakersfield. 

There could be more March magic for the UCLA team that captivated a city, if not a country.

https://t.co/2NjDZxl5jL",20,7,No,en,no media
1457755801645461517,2021-11-08 17:04:01+00:00,Matthew Stafford will have games like this: Takeaways from Rams' loss to Titans https://t.co/3bhMy51jAz,1,1,No,en,no media
1457747999342403585,2021-11-08 16:33:01+00:00,Dodgers Dugout: Vote for our Dodgers Hall of Fame https://t.co/luIpncDUeB,0,0,No,en,no media
1457743072352038919,2021-11-08 16:13:26+00:00,"More Chargers-Eagles coverage:

Full-game recap https://t.co/Wdz5blLdjx

By the numbers https://t.co/EE1Nb5mqe1 https://t.co/oJRictyhQs",0,0,No,en,photo
1457743068640153605,2021-11-08 16:13:25+00:00,"In a raucous locker room afterward, Hopkins was cited for his tiebreaking field goal with two seconds left.

“I had to introduce myself to some of the fellas,” joked the veteran kicker who had just finished playing his second game with the Chargers.

https://t.co/hOX5CPkt1v",0,0,No,en,no media
1457743067218251783,2021-11-08 16:13:25+00:00,"Remember Justin Herbert’s struggles? 

Forget Justin Herbert’s struggles.

He finished 32 of 38 for 356 yards and two touchdowns with no interceptions. The 84.2% accuracy is the best of Herbert’s 23 career starts.

He also rushed for a touchdown.

https://t.co/5c2jKw0JSA https://t.co/uc73DmQJXM",0,0,No,en,photo
1457743064462594050,2021-11-08 16:13:24+00:00,"Dustin Hopkins booted a 29-yard field goal in the closing seconds to cap a dominant, game-grabbing drive that stilled a once-chaotic Lincoln Financial Field.

https://t.co/5c2jKw0JSA",0,0,No,en,no media
1457743061635661829,2021-11-08 16:13:24+00:00,"🧵The Chargers halted a two-game losing streak and moved into first place in the AFC West with a 27-24 win over the Philadelphia Eagles.

Here's our coverage ...

https://t.co/5dKh4nQSL3 https://t.co/bFfhl9LTj1",5,2,No,en,photo
1457740952530038786,2021-11-08 16:05:01+00:00,Prep Rally: The best story in high school sports is at the California School for the Deaf in Riverside https://t.co/ycoepkfvxU,1,0,No,en,no media
1457733708060848131,2021-11-08 15:36:14+00:00,"More Rams-Titans coverage:

Full-game recap https://t.co/xincWjo9Cn

What we learned https://t.co/M1CkzWuU8c

By the numbers https://t.co/rta75dN3mu

Top photos https://t.co/bN2VUwne8i https://t.co/EmyMkgoGfM",2,3,No,en,photo
1457733701085765634,2021-11-08 15:36:12+00:00,"The Titans were missing two starters on the offensive line and star RB Derrick Henry.

Most observers thought Sunday night’s game against the Rams wouldn’t be a fair fight.

Sadly for the Rams, those people were correct, @LATimesfarmer writes.

https://t.co/9GhePfdWHn",2,2,No,en,no media
1457733699995197446,2021-11-08 15:36:12+00:00,"Stafford looked out of rhythm and nothing like a QB who has been considered an MVP candidate. 

He was sacked twice on consecutive plays. 

He also had passes intercepted on two plays in a row, one that was returned for a touchdown.

https://t.co/rcoJqOqNvg",0,0,No,en,no media
1457733698162335745,2021-11-08 15:36:11+00:00,"🧵Matthew Stafford and the Rams had a rough time against the Tennessee Titans last night.

Here's our coverage of the  28-16 defeat that brought the Rams' four-game winning streak to an end ...

https://t.co/p1IJRyY9rx https://t.co/AelR7LJMiI",0,0,No,en,photo
1457732898203783171,2021-11-08 15:33:00+00:00,5 takeaways from Chargers' win over Eagles: Dustin Hopkins kicks-starts special teams https://t.co/SCnoCGjFHQ,0,0,No,en,no media
1457725862544121859,2021-11-08 15:05:03+00:00,More March magic could await No. 2 UCLA when season begins this week https://t.co/Ncu8F7Su3w,0,0,No,en,no media
1457711356812009484,2021-11-08 14:07:25+00:00,"#Chargers day after: “Kickers, we got a stigma about us. I don’t want to say we’re outsiders, but it’s just a different job being super specialized. ... So, anytime you can start off well and try to build those relationships early, I think it helps…” https://t.co/bkEuhw6hq8",0,5,Yes,en,no media
1457710752735842307,2021-11-08 14:05:01+00:00,The Sports Report: Rams lose; Chargers and Clippers win https://t.co/jjVPfbDCyb,0,0,No,en,no media
1457600021864464394,2021-11-08 06:45:00+00:00,"Forget Derrick Henry, the Rams are going to remember the Titans' dominant defense https://t.co/bG8qdOaPi8",2,1,No,en,no media
1457594992260796417,2021-11-08 06:25:01+00:00,Rams can't recover from Matthew Stafford's Jared Goff-like start in loss to Titans https://t.co/4wOAmHqMEr,2,1,No,en,no media
1457593481749217288,2021-11-08 06:19:01+00:00,Rams' 28-16 loss to Tennessee Titans by the numbers https://t.co/rD1xbaVYRf,0,1,No,en,no media
1457592319549403136,2021-11-08 06:14:24+00:00,"Forget Derrick Henry, the Rams are going to remember the Titans' dominant defense  https://t.co/bG8qdOaPi8",1,1,No,en,no media
1457590864801251328,2021-11-08 06:08:37+00:00,Paul George on why his combination with Mann and Kennard has clicked so well. https://t.co/7kKc9YvKEg,0,20,Yes,en,video
1457590437951143938,2021-11-08 06:06:55+00:00,Rams can't recover from Matthew Stafford's Jared Goff-like start in loss to Titans https://t.co/4wOAmH9bfR,10,3,No,en,no media
1457589708268126210,2021-11-08 06:04:01+00:00,Photos: Matthew Stafford and Rams fall to Titans at SoFi Stadium https://t.co/hYDKF9IFFe,2,3,No,en,no media
1457584925952155652,2021-11-08 05:45:01+00:00,Paul George helps Clippers extend winning streak in triumph over Hornets https://t.co/qenGvBNE8O,24,2,No,en,no media
1457579892099399680,2021-11-08 05:25:01+00:00,Troy Terry and Benoit-Oliver Groulx lead Ducks to victory over Blues https://t.co/R0aJ5DcBYB,2,0,No,en,no media
1457570089503395842,2021-11-08 04:46:04+00:00,"Final: Clippers 120, Hornets 106

Clippers are 5-4 and have won four straight.

Next up: Portland on Tuesday.",0,7,Yes,en,no media
1457569670047813633,2021-11-08 04:44:24+00:00,"Rams undone by turnovers, penalties and lackluster offense in 28-16 loss to Titans https://t.co/rKPosvO70N",2,1,No,en,no media
1457554725570813955,2021-11-08 03:45:01+00:00,"Back in gear, Chargers offense has drive to beat Eagles on final possession, 27-24 https://t.co/turDRpLXLd",0,1,No,en,no media
1457548014520733708,2021-11-08 03:18:21+00:00,"Halftime: Terance Mann hits a falling three-pointer before the buzzer to give the Clippers a 61-58 lead.

Batum: 13 points
George: 11 points, 5 reb, 6 ast",0,2,Yes,en,no media
1457544407964598277,2021-11-08 03:04:01+00:00,Chargers' 27-24 victory over Philadelphia Eagles by the numbers https://t.co/irACi52IUF,0,0,No,en,no media
1457536090764562433,2021-11-08 02:30:58+00:00,"No update from Donte Williams on USC RB Keaontay Ingram, other than to say he suffered a lower leg injury.",0,2,Yes,en,no media
1457533690121052162,2021-11-08 02:21:26+00:00,Live updates: Rams trail Titans 14-3 after two Matthew Stafford interceptions https://t.co/rKPosvO70N,0,1,No,en,no media
1457533548039049228,2021-11-08 02:20:52+00:00,"Both USC QBs Kedon Slovis (lower leg) and Jaxson Dart (hand) were dealing some form of minor injury Saturday night, Donte Williams said. 

Both QB’s, however, played in the 4Q.",0,2,Yes,en,no media
1457529561269383168,2021-11-08 02:05:01+00:00,Galaxy and LAFC fail to wrap up MLS Cup playoff berths https://t.co/7PGwLb9ofW,7,3,No,en,no media
1457526789685727237,2021-11-08 01:54:00+00:00,"Galaxy and LAFC fail to wrap up MLS Cup playoff berths
https://t.co/7PGwLbqZ7u",0,0,No,en,no media
1457514432280477698,2021-11-08 01:04:54+00:00,"WE'RE ALL TIED UP!

@CH14_ gets his 17th of the season and we're LEVEL with the Loons https://t.co/ylXwT9bmlQ",0,99,Yes,en,video
1457513708268228611,2021-11-08 01:02:02+00:00,Kyle Larson takes first NASCAR Cup title in comeback season after suspension https://t.co/K6q9F7vuBX,1,0,No,en,no media
1457505902056124420,2021-11-08 00:31:00+00:00,NFL roundup: Jaguars upset Bills in touchdown-free game; Broncos beat Cowboys https://t.co/L61wpWwxRI,0,1,No,en,no media
1457502241120681990,2021-11-08 00:16:28+00:00,Dustin Hopkins kicks late field goal to lift Chargers to 27-24 victory over Eagles https://t.co/nKnTjKRsJh,9,2,No,en,no media
1457502000522821636,2021-11-08 00:15:30+00:00,Von Miller will not make his debut for Rams vs. Titans tonight https://t.co/TsJdgait6Z,0,0,No,en,no media
1457499359277461507,2021-11-08 00:05:00+00:00,Photos: Scenes around the L.A. Marathon https://t.co/tNrHOSI02F,1,2,No,en,no media
1457497885373730817,2021-11-07 23:59:09+00:00,"Rams inactives: QB Bryce Perkins, LB Von Miller, LB Chris Garrett, OL Alaric Jackson, TE Brycen Hopkins",0,5,Yes,en,no media
1457490804683988994,2021-11-07 23:31:01+00:00,"Dodgers make qualifying offers to Corey Seager, Chris Taylor, but not Clayton Kershaw https://t.co/7q5VqD1iuX",5,6,No,en,no media
1457475703792885761,2021-11-07 22:31:01+00:00,Venice achieves historic victory in City Section girls' volleyball https://t.co/aXtscdwRfT,1,1,No,en,no media
1457464873063911424,2021-11-07 21:47:58+00:00,Getting ready for Rams-Titans at SoFi Stadium. https://t.co/5QuKhZ6PQS,0,5,Yes,en,photo
1457464858148884482,2021-11-07 21:47:55+00:00,Clayton Kershaw was the only other Dodgers free agent eligible for the qualifying offer. The QO is worth $18.4 million.,0,7,Yes,en,no media
1457464842424504320,2021-11-07 21:47:51+00:00,The Dodgers announced they extended qualifying offers to Corey Seager and Chris Taylor.,0,24,Yes,en,no media
1457464792675876873,2021-11-07 21:47:39+00:00,Without Derrick Henry. a marquee Rams-Titans matchup has turned into war of attrition https://t.co/rtImNNH4wL,0,1,Yes,en,no media
1457464064930566145,2021-11-07 21:44:46+00:00,Live updates: #Chargers up 7-0 lead over Eagles after one quarter https://t.co/1i3GJXeLzK,0,1,Yes,en,no media
1457462863904206849,2021-11-07 21:39:59+00:00,"on the board. 

@S_Anderson89 | 📺: CBS https://t.co/zjGcojcXDS",0,72,Yes,en,video
1457460603736502276,2021-11-07 21:31:00+00:00,High school girls' volleyball: Southern California and Northern California Regional pairings https://t.co/JTNVQkPWg9,0,0,No,en,no media
1457451424934072320,2021-11-07 20:54:32+00:00,"Justin Herbert and the Chargers look to put their losses to the Ravens and Patriots behind them when they take on the Philadelphia Eagles on the road.

Follow long with our game updates and more: https://t.co/nKnTjKRsJh",1,2,No,en,no media
1457450879003492357,2021-11-07 20:52:22+00:00,"An 8-man football championship for California School for the Deaf-Riverside wouldn’t just mean a trophy - to the team, it would mean proving the hearing’s perception of the deaf wrong. 

My latest for @latimessports: https://t.co/sINOOuXnra",0,13,Yes,en,no media
1457443481190731777,2021-11-07 20:22:58+00:00,"#Chargers vs. Philadelphia Eagles: Live updates, odds and how to watch https://t.co/1i3GJXeLzK",0,3,Yes,en,no media
1457431784157630464,2021-11-07 19:36:29+00:00,"#Chargers’ inactives: CB Michael Davis (hamstring), CB Asante Samuel Jr. (concussion protocol), S Alohi Gilman (ankle), RB Justin Jackson (quadriceps), FB Gabe Nabers, QB Easton Stick and OL Trey Pipkins. https://t.co/PObcp6YSPK",0,1,Yes,en,no media
1457431771700555777,2021-11-07 19:36:26+00:00,"#Chargers CB Tevaughn Campbell (groin) who was questionable, is active for today’s game against Philly.",0,1,Yes,en,no media
1457430407117422602,2021-11-07 19:31:01+00:00,USC takeaways: Trojans left with more questions after loss to Arizona State https://t.co/UrcVvD16JT,3,3,No,en,no media
1457426061122097154,2021-11-07 19:13:45+00:00,"USC struggled to fill the gaping void left by Drake London. It struggled to run the ball with Keaontay Ingram. It struggled to … ok, you get it. 

Some takeaways from USC’s desert defeat at Arizona State: https://t.co/b2NfjXgmkl",0,7,Yes,en,no media
1457423865018294275,2021-11-07 19:05:01+00:00,Lakers' Russell Westbrook knows he needs to 'play harder' https://t.co/T7qoc8w5OA,2,0,No,en,no media
1457421171075391488,2021-11-07 18:54:19+00:00,"Happy #DecisionDay.

@kbaxter11 has everything you need to know about the potential playoff paths for @LAGalaxy and @LAFC ⤵️ https://t.co/Q1CuDOdMnq",0,2,Yes,en,no media
1457412541529968644,2021-11-07 18:20:01+00:00,California School for the Deaf-Riverside has 8-man football title hopes https://t.co/MFZH1D5s3O,1,0,No,en,no media
1457408762831155203,2021-11-07 18:05:01+00:00,Column: Germany's Hero Kanu chasing his football dream at Santa Margarita High https://t.co/mjggKM7bTS,23,10,No,en,no media
1457407308502224896,2021-11-07 17:59:14+00:00,"This had the makings of a landmark season for the Raiders. Instead, it’s a franchise awash in turmoil and tragedy as the team heads into the second half of the NFL schedule

https://t.co/iUqSfWHaHW",1,2,No,en,no media
1457407227233333248,2021-11-07 17:58:54+00:00,The @latimessports has more #Lakers coverage with: Lakers' Russell Westbrook knows he needs to 'play harder' https://t.co/49CGyXusqI,0,4,Yes,en,no media
1457406328859680768,2021-11-07 17:55:20+00:00,USC's two-quarterback strategy flounders in loss to Arizona State https://t.co/pYmO2uZDcc,0,0,No,en,no media
1457406261201457155,2021-11-07 17:55:04+00:00,"Ten years after the Sandusky scandal, what did Penn State — and the nation — learn? https://t.co/7k7sFcnovr",0,0,No,en,no media
1457397417138012161,2021-11-07 17:19:56+00:00,ICYMI….⁦@LAGalaxy’s ⁩ @MLS playoff path is straightforward; @LAFC’s is a bit more complicated https://t.co/5CxmK3lNuw,0,4,Yes,en,no media
1457396508026826758,2021-11-07 17:16:19+00:00,"California School for the Deaf-Riverside's 8-man football program has never won a championship or even made it past the second round of the section playoffs.

This season, they’ve steamrolled opponents with a perfect 10-0 record:

https://t.co/MFZH1Dn2Vm",2,0,No,en,no media
1457387478411743235,2021-11-07 16:40:26+00:00,Everyone feeling refreshed with an extra hour of sleep? Beautiful morning at Santa Anita watching horses work out. https://t.co/9kaTzi21cR,0,2,Yes,en,no media
1457383822962544642,2021-11-07 16:25:54+00:00,"L.A. Marathon: Everything you need to know about this year’s race

https://t.co/Vnfheux5Ln",17,4,No,en,no media
1457378566241460225,2021-11-07 16:05:01+00:00,"Rams vs. Titans matchups: In prime time, L.A. faces tougher opponent https://t.co/OdXkZGOuYK",0,0,No,en,no media
1457371445902725120,2021-11-07 15:36:44+00:00,Can Justin Herbert and the #Chargers' offense bounce back today at Philly? https://t.co/uzqVGnCJSc,0,1,Yes,en,no media
1457371426055286787,2021-11-07 15:36:39+00:00,A weighty decision looms for Canelo #Álvarez after latest triumph: https://t.co/MjXbmiqbwu,0,3,Yes,en,no media
1457363257946116100,2021-11-07 15:04:11+00:00,Two Trojans quarterbacks are not better than one in an aimless loss at Arizona State: https://t.co/1P7yeUA27R,0,9,Yes,en,no media
1457363216787406853,2021-11-07 15:04:02+00:00,California School for the Deaf-Riverside has 8-man football title hopes https://t.co/77j7zj78Nb,0,13,Yes,en,no media
1457363174173200388,2021-11-07 15:03:51+00:00,#Chargers vs. Eagles matchups: L.A. looks to break out of funk https://t.co/5KSOj5xnWE,0,1,Yes,en,no media
1457363152442576901,2021-11-07 15:03:46+00:00,Why the #Chargers aren't worried about Keenan Allen's pass-catching woes https://t.co/r7YGixB9yR,0,2,Yes,en,no media
1457348366275387395,2021-11-07 14:05:01+00:00,Chargers vs. Eagles matchups: L.A. looks to break out of funk https://t.co/bNTny9GW6J,0,0,No,en,no media
1457318165424316420,2021-11-07 12:05:00+00:00,Hernández: A weighty decision looms for Canelo Álvarez after latest triumph https://t.co/jLcI6BmTcy,2,0,No,ca,no media
1457233154486407173,2021-11-07 06:27:12+00:00,USC’s two-quarterback strategy flounders in 31-16 loss to Arizona State https://t.co/pYmO2uI1NC,2,2,No,en,no media
1457225405367087110,2021-11-07 05:56:25+00:00,"FINAL: USC loses an ugly one to Arizona State in the desert, 31-16, dropping its fifth game of the season.",0,4,Yes,en,no media
1457223883254222852,2021-11-07 05:50:22+00:00,"El Mexican GOAT: Canelo Álvarez.

https://t.co/XHuz0iBIYw https://t.co/ryPVhqRpv4",0,11,Yes,ro,video
1457223831118962693,2021-11-07 05:50:09+00:00,"USC’s defense didn’t have much fight on that final drive. A touchdown from Rachaad White should put it away. 

ASU leads USC, 31-16.",0,3,Yes,en,no media
1457218602466091010,2021-11-07 05:29:23+00:00,"Rachaad White breaks through USC’s front, and he’s gone, untouched for 50 yards. He has 175 yards and two touchdowns today.",0,3,Yes,en,no media
1457217502560325635,2021-11-07 05:25:01+00:00,High school football: City and Southern Section playoff results and updated pairings https://t.co/lILUpcZeqa,0,0,No,en,no media
1457215991608483841,2021-11-07 05:19:00+00:00,High school boys’ water polo: Southern Section playoff results and updated pairings https://t.co/0oeMroomTB,0,0,No,en,no media
1457212227753164803,2021-11-07 05:04:03+00:00,"Sorry all, couldn’t get reception and had to write up a story. But Marymount is your CIF Southern Section champion, beating Mira Costa 3-1 - here’s video from the final point: https://t.co/ILDJHS7AY3",0,1,Yes,en,no media
1457212216248344577,2021-11-07 05:04:00+00:00,High school girls' volleyball: City and Southern Section championship results https://t.co/kdHlkdwU9G,0,0,No,en,no media
1457211702924042253,2021-11-07 05:01:58+00:00,Canelo Álvarez knocks out Caleb Plant to become boxing's undisputed super middleweight champ https://t.co/DESqrJ2VS5,9,2,No,en,no media
1457207440118792197,2021-11-07 04:45:01+00:00,Elia Rubin powers Marymount volleyball to Division 1 championship win over Mater Dei https://t.co/2UE5hNwSoV,1,0,No,en,no media
1457204734536806403,2021-11-07 04:34:16+00:00,Canelo Álvarez defeats Caleb Plant to become boxing's undisputed middleweight champion https://t.co/DESqrJ2VS5,9,0,No,en,no media
1457203540762398721,2021-11-07 04:29:32+00:00,Canelo drops Plant twice in the 11th and it’s over.,0,4,Yes,en,no media
1457201867218292738,2021-11-07 04:22:53+00:00,Lakers getting smacked 93-62 by Portland end of third,0,4,Yes,en,no media
1457200396242284555,2021-11-07 04:17:02+00:00,"USC trails Arizona State 14-10 at halftime. The first half featured: 

☑️2 USC quarterbacks
☑️2 turnovers forced by USC's defense
☑️ More ASU penalties than USC penalties
☑️ 1 🦊 on the field 

Watch first half highlights and follow our live updates ⤵️

https://t.co/USyMzcIvbJ https://t.co/bOxp9VUZw8",0,3,Yes,en,no media
1457198153959018496,2021-11-07 04:08:07+00:00,"Halftime at Sun Devil Stadium: USC trails Arizona State, 14-10. 

The Trojans really miss Drake London. And the run game isn’t doing them any favors. Outside of one 24-yard gain, USC hasn’t found any room to run.",0,2,Yes,en,no media
1457192336291737603,2021-11-07 03:45:00+00:00,Anthony Davis exits Lakers vs. Trail Blazers because of stomach illness https://t.co/oOoM349R3V,1,0,No,en,no media
1457191887421382662,2021-11-07 03:43:13+00:00,Lakers down 51-36 at the half to Portland,0,2,Yes,en,no media
1457190733291483140,2021-11-07 03:38:38+00:00,#CaneloPlant is starting right now. Follow along with @latimessports. https://t.co/2FULXSffVZ,0,1,Yes,en,no media
1457187558408916992,2021-11-07 03:26:01+00:00,"Anthony Davis exits Lakers vs. Trail Blazers because of stomach illness
https://t.co/oOoM33SfFl",4,1,No,en,no media
1457184598371168257,2021-11-07 03:14:16+00:00,Lakers say Anthony Davis will not return because of stomach illness.,0,13,Yes,en,no media
1457182751900127243,2021-11-07 03:06:55+00:00,"Lakers down 36-14 to Portland end of first. Lakers shooting 25% from the field, have missed all 6 of 3-pointers. Blazers making 57.7% of shots, 41.7% of threes.",0,6,Yes,en,no media
1457181694033682440,2021-11-07 03:02:43+00:00,"#CaneloPlant fight: Follow along for live updates, odds, start time and more https://t.co/DESqrJ2VS5",1,2,No,en,no media
1457181430753103879,2021-11-07 03:01:40+00:00,So much for the face mask requirement in the MGM Grand ... guessing at least 90% of people in the arena for #CaneloPlant are unmasked.,0,2,Yes,en,no media
1457178547244572675,2021-11-07 02:50:13+00:00,Good dog. https://t.co/7uF3RSroSQ,0,125,Yes,en,video
1457167172980121609,2021-11-07 02:05:01+00:00,Victor Espinoza rides Ce Ce to upset in Breeders Cup' Filly and Mare Sprint https://t.co/dftfCj6Mny,1,0,No,en,no media
1457166920051040267,2021-11-07 02:04:01+00:00,Knicks Go defies age and beats the favorites to win the Breeders' Cup Classic https://t.co/aMX6JVe4Ry,3,2,No,en,no media
1457154656543526914,2021-11-07 01:15:17+00:00,Knicks Go defies age and beats the favorites to win the Breeders’ Cup Classic https://t.co/aMX6JUWtsY,3,2,No,en,no media
1457151622040076290,2021-11-07 01:03:13+00:00,Good evening from the MGM Grand. #CaneloPlant https://t.co/ivxBSbtGow,0,2,Yes,en,photo
1457151607250903043,2021-11-07 01:03:10+00:00,"AD on floor testing thumb, per Vogel. No answer yet if he’s playing",0,4,Yes,en,no media
1457151576779354112,2021-11-07 01:03:03+00:00,"I polled my boxing brethren about #CaneloPlant.

Here are their predictions &amp;  picks for the PPV fight.

@dylanohernandez
@GregBishopSI
@KevinI
@JakeNDaBox
@dougiefischer
@AndreasHale
@DanRafael1
@SteveKim323
@BySamGordon
@MWhicker03
@ecauich 
@jadelreda 

https://t.co/b3i75Lvzhk https://t.co/GpXlb6TB9P",0,12,Yes,en,no media
1457147183136792576,2021-11-07 00:45:35+00:00,"Here at Mira Costa tonight covering the CIF Southern Section girls’ volleyball championship between Mater Dei and Marymount for @latimessports. 

Updates to come in this thread! https://t.co/SqzNiRJf0z",0,3,Yes,en,no media
1457147159715876868,2021-11-07 00:45:30+00:00,"Ivica Zubac had his turn-the-corner game Friday. 

Is Eric Bledsoe next? https://t.co/OaJgFSPavI",0,1,Yes,en,no media
1457141727450435584,2021-11-07 00:23:54+00:00,Round x Round En Vivo: Canelo vs. Plant pelean por el campeonato indiscutible en Las Vegas https://t.co/9B5kXAPazl,0,5,Yes,es,no media
1457140322761273348,2021-11-07 00:18:19+00:00,Getting ready for the Breeders’ Cup Classic. Race should set up for Hot Rod Charlie. https://t.co/eyOmiI1Zu7,0,1,Yes,en,photo
1457136968983187461,2021-11-07 00:05:00+00:00,"Canelo Álvarez looks to become an undisputed champion tonight when he fights Caleb Plant, and @latimes' Latino Life has all of your boxing coverage.

We have expert analysis of the fight, live blogs in English and Spanish, and stories in both languages.

https://t.co/XHuz0iBIYw https://t.co/72FYIDRdsM",0,10,Yes,en,no media
1457126741047058433,2021-11-06 23:24:21+00:00,Marquee Rams-Titans matchup has turned into war of attrition https://t.co/FPNg8PkQec,0,1,No,en,no media
1457124001499648004,2021-11-06 23:13:28+00:00,That feeling when you #BeatTheBruins! https://t.co/qr1LHA0rHb,0,22,Yes,en,photo
1457115900226588673,2021-11-06 22:41:17+00:00,Granderson: You heard right. Aaron Rodgers played the Martin Luther King Jr. card (via @latimesopinion) https://t.co/77EpyKBmRC,0,23,Yes,en,no media
1457106774738280448,2021-11-06 22:05:01+00:00,Experts make their picks for Canelo Álvarez vs. Caleb Plant https://t.co/BrAfG3hKEr,0,0,No,es,no media
1457098216105811968,2021-11-06 21:31:00+00:00,College football: No. 5 Ohio State turns back Nebraska https://t.co/qqYZ8JtA91,0,0,No,en,no media
1457092932683640841,2021-11-06 21:10:01+00:00,Trail Blazers hire firm to look at workplace environment concerns https://t.co/qK4WFpBAnZ,0,0,No,en,no media
1457092559705022468,2021-11-06 21:08:32+00:00,Experts make their picks for Canelo Álvarez vs. Caleb Plant https://t.co/BrAfG309fR,1,2,No,es,no media
1457090588281479170,2021-11-06 21:00:42+00:00,L.A. launches program to expand youth sports access https://t.co/jWFnO9hAVZ,0,10,Yes,en,no media
1457083117072789512,2021-11-06 20:31:01+00:00,Chicago Blackhawks fire coach Jeremy Colliton https://t.co/HwyUkQdzH1,0,0,No,en,no media
1457076324514865157,2021-11-06 20:04:01+00:00,Letters to Sports: Inglewood's 106-0 win lacked class https://t.co/Yw65rSidDJ,2,0,No,en,no media
1457068018769477638,2021-11-06 19:31:01+00:00,Marquee Rams-Titans matchup has turned into war of attrition https://t.co/FPNg8PCrCM,0,0,No,en,no media
1457061475554574348,2021-11-06 19:05:01+00:00,Ivica Zubac has breakout game for Clippers. Is Eric Bledsoe next? https://t.co/LrVIUnTe6M,1,0,No,en,no media
1457052918729871363,2021-11-06 18:31:01+00:00,High school football: Canoga Park tops Franklin in overtime https://t.co/P654iRK0iW,0,0,No,en,no media
1457046374890020866,2021-11-06 18:05:01+00:00,Galaxy's MLS playoff path is straightforward; LAFC's is a bit more complicated https://t.co/8RT1X7lKjg,1,0,No,en,no media
1457035050109882370,2021-11-06 17:20:01+00:00,Is something wrong with Justin Herbert? Chargers' game at Eagles could answer that https://t.co/L0LvHNpvRF,1,0,No,en,no media
1457031276171603970,2021-11-06 17:05:01+00:00,A season of promise for the Raiders turns into one marred by turmoil and tragedy https://t.co/iUqSfWpzQo,0,0,No,en,no media
1457001077828722692,2021-11-06 15:05:01+00:00,Joe Kelly expected to be ready for start of season. Will he be with Dodgers? https://t.co/GBD3ygRTKz,1,0,No,en,no media
1456970882878955529,2021-11-06 13:05:02+00:00,Hernández: Canelo Álvarez ready for the most personal fight of his career against Caleb Plant https://t.co/zZCheSWaCI,2,1,No,ro,no media
